date,title,url,president
"Mar 12, 1986",Interview With Representatives of the Baltimore Sun,https://www.presidency.ucsb.edu/documents/interview-with-representatives-the-baltimore-sun,Ronald Reagan
"Mar 13, 1986",Remarks at an Exhibit of Weapons Captured in Central America,https://www.presidency.ucsb.edu/documents/remarks-exhibit-weapons-captured-central-america,Ronald Reagan
"Mar 14, 1986",Remarks to Elected Officials During a White House Briefing on United States Assistance for the Nicaraguan Democratic Resistance,https://www.presidency.ucsb.edu/documents/remarks-elected-officials-during-white-house-briefing-united-states-assistance-for-the,Ronald Reagan
"Mar 14, 1986","Message to the Congress on Freedom, Regional Security, and Global Peace",https://www.presidency.ucsb.edu/documents/message-the-congress-freedom-regional-security-and-global-peace,Ronald Reagan
"Mar 15, 1986",Radio Address to the Nation on the Situation in Nicaragua,https://www.presidency.ucsb.edu/documents/radio-address-the-nation-the-situation-nicaragua,Ronald Reagan
"Mar 16, 1986",Address to the Nation on the Situation in Nicaragua,https://www.presidency.ucsb.edu/documents/address-the-nation-the-situation-nicaragua,Ronald Reagan
"Mar 17, 1986","Informal Exchange With Reporters Prior to a Meeting With Ambassador Philip C. Habib, Special Envoy for Central America",https://www.presidency.ucsb.edu/documents/informal-exchange-with-reporters-prior-meeting-with-ambassador-philip-c-habib-special,Ronald Reagan
"Mar 18, 1986",Informal Exchange With Reporters Prior to a Meeting With Prime Minister Brian Mulroney of Canada,https://www.presidency.ucsb.edu/documents/informal-exchange-with-reporters-prior-meeting-with-prime-minister-brian-mulroney-canada,Ronald Reagan
"Mar 19, 1986",Message to the Congress on United States Assistance for the Nicaraguan Democratic Resistance,https://www.presidency.ucsb.edu/documents/message-the-congress-united-states-assistance-for-the-nicaraguan-democratic-resistance,Ronald Reagan
"Mar 20, 1986",Statement on House of Representatives Disapproval of United States Assistance for the Nicaraguan Democratic Resistance,https://www.presidency.ucsb.edu/documents/statement-house-representatives-disapproval-united-states-assistance-for-the-nicaraguan-0,Ronald Reagan
"Mar 21, 1986",Remarks at a White House Reception for Private Sector Supporters of United States Assistance for the Nicaraguan Democratic Resistance,https://www.presidency.ucsb.edu/documents/remarks-white-house-reception-for-private-sector-supporters-united-states-assistance-for,Ronald Reagan
"Mar 21, 1986","Interview With R.W. Apple, Jr., Gerald M. Boyd, and Bernard Weinraub of the New York Times",https://www.presidency.ucsb.edu/documents/interview-with-rw-apple-jr-gerald-m-boyd-and-bernard-weinraub-the-new-york-times,Ronald Reagan
"Mar 22, 1986",Radio Address to the Nation on United States Assistance for the Nicaraguan Democratic Resistance,https://www.presidency.ucsb.edu/documents/radio-address-the-nation-united-states-assistance-for-the-nicaraguan-democratic-1,Ronald Reagan
"Mar 26, 1986",Statement by Principal Deputy Press Secretary Speakes on the Nicaraguan Incursion Into Honduras,https://www.presidency.ucsb.edu/documents/statement-principal-deputy-press-secretary-speakes-the-nicaraguan-incursion-into-honduras,Ronald Reagan
"Mar 27, 1986",Statement on Senate Approval of United States Assistance for the Nicaraguan Democratic Resistance,https://www.presidency.ucsb.edu/documents/statement-senate-approval-united-states-assistance-for-the-nicaraguan-democratic-1,Ronald Reagan
"Mar 27, 1986","Remarks at a Senate Campaign Fundraiser for Representative W. Henson Moore in New Orleans, Louisiana",https://www.presidency.ucsb.edu/documents/remarks-senate-campaign-fundraiser-for-representative-w-henson-moore-new-orleans-louisiana,Ronald Reagan
"Mar 29, 1986",Radio Address to the Nation on International Violence and Democratic Values,https://www.presidency.ucsb.edu/documents/radio-address-the-nation-international-violence-and-democratic-values,Ronald Reagan
"Apr 08, 1986",Statement by Principal Deputy Press Secretary Speakes on Negotiations Between the Contadora Group and Nicaragua,https://www.presidency.ucsb.edu/documents/statement-principal-deputy-press-secretary-speakes-negotiations-between-the-contadora,Ronald Reagan
"Apr 09, 1986",Remarks and a Question-and-Answer Session With the American Society of Newspaper Editors,https://www.presidency.ucsb.edu/documents/remarks-and-question-and-answer-session-with-the-american-society-newspaper-editors,Ronald Reagan
"Apr 09, 1986",The President's News Conference,https://www.presidency.ucsb.edu/documents/the-presidents-news-conference-959,Ronald Reagan
"Apr 14, 1986",Remarks at a White House Meeting with the Associated General Contractors of America,https://www.presidency.ucsb.edu/documents/remarks-white-house-meeting-with-the-associated-general-contractors-america,Ronald Reagan
"Apr 15, 1986",Remarks at a White House Meeting With Members of the American Business Conference,https://www.presidency.ucsb.edu/documents/remarks-white-house-meeting-with-members-the-american-business-conference-0,Ronald Reagan
"Apr 16, 1986",Remarks. on Signing the Law Day U.S.A. Proclamation,https://www.presidency.ucsb.edu/documents/remarks-signing-the-law-day-usa-proclamation-0,Ronald Reagan
"Apr 17, 1986",Remarks at the Annual White House Correspondents Dinner,https://www.presidency.ucsb.edu/documents/remarks-the-annual-white-house-correspondents-dinner,Ronald Reagan
"Apr 22, 1986",Notice of the Continuation of the National Emergency With Respect to Nicaragua,https://www.presidency.ucsb.edu/documents/notice-the-continuation-the-national-emergency-with-respect-nicaragua-0,Ronald Reagan
"Apr 22, 1986",Remarks at the Heritage Foundation Anniversary Dinner,https://www.presidency.ucsb.edu/documents/remarks-the-heritage-foundation-anniversary-dinner,Ronald Reagan
"Apr 22, 1986",Message to the Congress on the Continuation of the National Emergency With Respect to Nicaragua,https://www.presidency.ucsb.edu/documents/message-the-congress-the-continuation-the-national-emergency-with-respect-nicaragua,Ronald Reagan
"Apr 23, 1986",Remarks to the International Forum of the Chamber of Commerce of the United States,https://www.presidency.ucsb.edu/documents/remarks-the-international-forum-the-chamber-commerce-the-united-states,Ronald Reagan
"May 21, 1986",Remarks at the Annual Republican Senate/House Fund-raising Dinner,https://www.presidency.ucsb.edu/documents/remarks-the-annual-republican-senatehouse-fund-raising-dinner-0,Ronald Reagan
"May 22, 1986",Statement by Principal Deputy Press Secretary Speakes on the Central American Peace Negotiations,https://www.presidency.ucsb.edu/documents/statement-principal-deputy-press-secretary-speakes-the-central-american-peace-negotiations,Ronald Reagan
"May 23, 1986",Message to the Congress Reporting on the National Emergency With Respect to Nicaragua,https://www.presidency.ucsb.edu/documents/message-the-congress-reporting-the-national-emergency-with-respect-nicaragua,Ronald Reagan
"May 27, 1986",Statement by Principal Deputy Press Secretary Speakes on the Central American Summit Meeting,https://www.presidency.ucsb.edu/documents/statement-principal-deputy-press-secretary-speakes-the-central-american-summit-meeting,Ronald Reagan
"May 27, 1986",Remarks Following Discussions With President Jose Simeon Azcona Hoyo of Honduras,https://www.presidency.ucsb.edu/documents/remarks-following-discussions-with-president-jose-simeon-azcona-hoyo-honduras,Ronald Reagan
"Jun 06, 1986",Remarks at a White House Briefing for Supporters of Tax Reform and United States Assistance for the Nicaraguan Democratic Resistance,https://www.presidency.ucsb.edu/documents/remarks-white-house-briefing-for-supporters-tax-reform-and-united-states-assistance-for,Ronald Reagan
"Jun 09, 1986",Remarks to the Georgetown University Center for Strategic and International Studies on United States Assistance for the Nicaraguan Democratic Resistance,https://www.presidency.ucsb.edu/documents/remarks-the-georgetown-university-center-for-strategic-and-international-studies-united,Ronald Reagan
"Jun 09, 1986",Written Responses to Questions on Central America Submitted by Radio Marti,https://www.presidency.ucsb.edu/documents/written-responses-questions-central-america-submitted-radio-marti,Ronald Reagan
"Jun 10, 1986",Letter to Congressional Leaders Transmitting a Report on the Situation in Central America,https://www.presidency.ucsb.edu/documents/letter-congressional-leaders-transmitting-report-the-situation-central-america,Ronald Reagan
"Jun 11, 1986",The President's News Conference,https://www.presidency.ucsb.edu/documents/the-presidents-news-conference-958,Ronald Reagan
"Jun 13, 1986",Remarks and a Question-and-Answer Session at a White House Luncheon for Regional Editors and Broadcasters,https://www.presidency.ucsb.edu/documents/remarks-and-question-and-answer-session-white-house-luncheon-for-regional-editors-and,Ronald Reagan
"Jun 16, 1986",Remarks at a White House Briefing for Supporters of United States Assistance for the Nicaraguan Democratic Resistance,https://www.presidency.ucsb.edu/documents/remarks-white-house-briefing-for-supporters-united-states-assistance-for-the-nicaraguan,Ronald Reagan
"Jun 23, 1986",Statement by Principal Deputy Press Secretary Speakes on United States Assistance for the Nicaraguan Democratic Resistance,https://www.presidency.ucsb.edu/documents/statement-principal-deputy-press-secretary-speakes-united-states-assistance-for-the,Ronald Reagan
"Jun 23, 1986",Remarks in an Interview Together With Written Responses to Questions Submitted by Le Point of France,https://www.presidency.ucsb.edu/documents/remarks-interview-together-with-written-responses-questions-submitted-le-point-france,Ronald Reagan
"Jun 24, 1986",Letter to the Speaker of the House of Representatives on United States Assistance for the Nicaraguan Democratic Resistance,https://www.presidency.ucsb.edu/documents/letter-the-speaker-the-house-representatives-united-states-assistance-for-the-nicaraguan,Ronald Reagan
"Jun 24, 1986",Address to the Nation on United States Assistance for the Nicaraguan Democratic Resistance,https://www.presidency.ucsb.edu/documents/address-the-nation-united-states-assistance-for-the-nicaraguan-democratic-resistance,Ronald Reagan
"Jun 25, 1986",Statement on House of Representatives Approval of United States Assistance for the Nicaraguan Democratic Resistance,https://www.presidency.ucsb.edu/documents/statement-house-representatives-approval-united-states-assistance-for-the-nicaraguan-0,Ronald Reagan
"Jun 25, 1986","Remarks at a Senate Campaign Fund-raising Dinner for Jim Santini in Las Vegas, Nevada",https://www.presidency.ucsb.edu/documents/remarks-senate-campaign-fund-raising-dinner-for-jim-santini-las-vegas-nevada,Ronald Reagan
"Jul 05, 1986",Radio Address to the Nation on Independence Day and the Centennial of the Statue of Liberty,https://www.presidency.ucsb.edu/documents/radio-address-the-nation-independence-day-and-the-centennial-the-statue-liberty,Ronald Reagan
"Jul 21, 1986",Remarks on Signing the Captive Nations Week Proclamation,https://www.presidency.ucsb.edu/documents/remarks-signing-the-captive-nations-week-proclamation-0,Ronald Reagan
"Jul 23, 1986","Remarks at a Campaign Fundraiser for William Clements in Dallas, Texas",https://www.presidency.ucsb.edu/documents/remarks-campaign-fundraiser-for-william-clements-dallas-texas,Ronald Reagan
"Jul 23, 1986","Remarks at a Republican Party Rally in Miami, Florida",https://www.presidency.ucsb.edu/documents/remarks-republican-party-rally-miami-florida,Ronald Reagan
"Aug 05, 1986","Remarks by Telephone to the Annual Convention of the Knights of Columbus in Chicago, Illinois",https://www.presidency.ucsb.edu/documents/remarks-telephone-the-annual-convention-the-knights-columbus-chicago-illinois,Ronald Reagan
"Aug 12, 1986",The President's News Conference,https://www.presidency.ucsb.edu/documents/the-presidents-news-conference-957,Ronald Reagan
"Aug 13, 1986",Statement on Senate Approval of United States Assistance for the Nicaraguan Democratic Resistance and for Economic Development in Central America,https://www.presidency.ucsb.edu/documents/statement-senate-approval-united-states-assistance-for-the-nicaraguan-democratic-0,Ronald Reagan
"Aug 14, 1986","Remarks in an Interview With Representatives of Excelsior of Mexico, Together With Written Responses to Questions",https://www.presidency.ucsb.edu/documents/remarks-interview-with-representatives-excelsior-mexico-together-with-written-responses,Ronald Reagan
"Sep 22, 1986","Address to the 41st Session of the United Nations General Assembly in New York, New York",https://www.presidency.ucsb.edu/documents/address-the-41st-session-the-united-nations-general-assembly-new-york-new-york,Ronald Reagan
"Sep 23, 1986",Remarks at a White House Briefing for Private Sector Supporters of United States Defense Policies,https://www.presidency.ucsb.edu/documents/remarks-white-house-briefing-for-private-sector-supporters-united-states-defense-policies,Ronald Reagan
"Sep 25, 1986",Remarks to Members of the National Fraternal Congress of America,https://www.presidency.ucsb.edu/documents/remarks-members-the-national-fraternal-congress-america,Ronald Reagan
"Oct 07, 1986",Remarks at the Republican Governors Association Dinner,https://www.presidency.ucsb.edu/documents/remarks-the-republican-governors-association-dinner,Ronald Reagan
"Oct 08, 1986",Informal Exchange With Reporters on the Budget,https://www.presidency.ucsb.edu/documents/informal-exchange-with-reporters-the-budget,Ronald Reagan
"Oct 08, 1986","Remarks at a Campaign Rally for Senator Mack Mattingly in Atlanta, Georgia",https://www.presidency.ucsb.edu/documents/remarks-campaign-rally-for-senator-mack-mattingly-atlanta-georgia,Ronald Reagan
"Oct 13, 1986",Address to the Nation on the Meetings With Soviet General Secretary Gorbachev in Iceland,https://www.presidency.ucsb.edu/documents/address-the-nation-the-meetings-with-soviet-general-secretary-gorbachev-iceland,Ronald Reagan
"Oct 22, 1986",Memorandum on Assistance to the Nicaraguan Democratic Resistance,https://www.presidency.ucsb.edu/documents/memorandum-assistance-the-nicaraguan-democratic-resistance-0,Ronald Reagan
"Nov 05, 1986",Remarks at a White House Briefing for Senior Staff on the Congressional and Gubernatorial Election Results,https://www.presidency.ucsb.edu/documents/remarks-white-house-briefing-for-senior-staff-the-congressional-and-gubernatorial-election,Ronald Reagan
"Nov 10, 1986",Letter to the Speaker of the House and the President of the Senate Reporting on the Nicaraguan Emergency,https://www.presidency.ucsb.edu/documents/letter-the-speaker-the-house-and-the-president-the-senate-reporting-the-nicaraguan,Ronald Reagan
"Nov 15, 1986",Radio Address to the Nation on Administration and Congressional Goals,https://www.presidency.ucsb.edu/documents/radio-address-the-nation-administration-and-congressional-goals,Ronald Reagan
"Nov 18, 1986",Remarks at the Ethics and Public Policy Center Anniversary Dinner,https://www.presidency.ucsb.edu/documents/remarks-the-ethics-and-public-policy-center-anniversary-dinner,Ronald Reagan
"Nov 19, 1986",The President's News Conference,https://www.presidency.ucsb.edu/documents/the-presidents-news-conference-963,Ronald Reagan
"Nov 21, 1986",Remarks at the Annual Senate Republican Dinner,https://www.presidency.ucsb.edu/documents/remarks-the-annual-senate-republican-dinner,Ronald Reagan
"Dec 02, 1986",Address to the Nation on the Investigation of the Iran Arms and Contra Aid Controversy,https://www.presidency.ucsb.edu/documents/address-the-nation-the-investigation-the-iran-arms-and-contra-aid-controversy,Ronald Reagan
"Dec 04, 1986",Remarks Following Discussions With President Oscar Arias Sanchez of Costa Rica,https://www.presidency.ucsb.edu/documents/remarks-following-discussions-with-president-oscar-arias-sanchez-costa-rica-0,Ronald Reagan
"Dec 10, 1986","Proclamation 5589—Human Rights Day, Bill of Rights Day, and Human Rights Week, 1986",https://www.presidency.ucsb.edu/documents/proclamation-5589-human-rights-day-bill-rights-day-and-human-rights-week-1986,Ronald Reagan
"Dec 10, 1986","Remarks on Signing the Human Rights Day, Bill of Rights Day, and Human Rights Week Proclamation",https://www.presidency.ucsb.edu/documents/remarks-signing-the-human-rights-day-bill-rights-day-and-human-rights-week-proclamation-0,Ronald Reagan
"Dec 27, 1986",Memorandum on Further Assistance to the Nicaraguan Democratic Resistance,https://www.presidency.ucsb.edu/documents/memorandum-further-assistance-the-nicaraguan-democratic-resistance,Ronald Reagan
"Jan 02, 1987",Letter to the Speaker of the House of Representatives and the President of the Senate on the Generalized System of Preferences,https://www.presidency.ucsb.edu/documents/letter-the-speaker-the-house-representatives-and-the-president-the-senate-the-generalized,Ronald Reagan
"Jan 02, 1987",Memorandum on the Generalized System of Preferences,https://www.presidency.ucsb.edu/documents/memorandum-the-generalized-system-preferences-2,Ronald Reagan
"Jan 05, 1987",Statement by Principal Deputy Press Secretary Speakes on the Iran Arms and Contra Aid Controversy,https://www.presidency.ucsb.edu/documents/statement-principal-deputy-press-secretary-speakes-the-iran-arms-and-contra-aid-1,Ronald Reagan
"Jan 24, 1987",Radio Address to the Nation on the State of the Union,https://www.presidency.ucsb.edu/documents/radio-address-the-nation-the-state-the-union-0,Ronald Reagan
"Jan 27, 1987",Address Before a Joint Session of Congress on the State of the Union,https://www.presidency.ucsb.edu/documents/address-before-joint-session-congress-the-state-the-union-1,Ronald Reagan
"Feb 10, 1987",Remarks to the Annual Leadership Conference of the American Legion,https://www.presidency.ucsb.edu/documents/remarks-the-annual-leadership-conference-the-american-legion-0,Ronald Reagan
"Feb 20, 1987",Remarks at the Conservative Political Action Conference Luncheon,https://www.presidency.ucsb.edu/documents/remarks-the-conservative-political-action-conference-luncheon,Ronald Reagan
"Feb 26, 1987",Statement of Administration Policy: S. 184 - To Provide Economic Assistance to the Central American Democracies and Disapproving Aid to the Contras,https://www.presidency.ucsb.edu/documents/statement-administration-policy-s-184-provide-economic-assistance-the-central-american,Ronald Reagan
"Feb 27, 1987",Excerpts from the Tower Commission Report,https://www.presidency.ucsb.edu/documents/excerpts-from-the-tower-commission-report,Ronald Reagan
"Mar 03, 1987",Message to the Congress on Economic Assistance for Central America,https://www.presidency.ucsb.edu/documents/message-the-congress-economic-assistance-for-central-america,Ronald Reagan
"Mar 03, 1987",Letter Accepting the Resignation of Patrick J. Buchanan as Assistant to the President and Director of Communications,https://www.presidency.ucsb.edu/documents/letter-accepting-the-resignation-patrick-j-buchanan-assistant-the-president-and-director,Ronald Reagan
"Mar 05, 1987",Presidential Determination No. 87-10 - Assistance for the Nicaraguan Democratic Resistance,https://www.presidency.ucsb.edu/documents/presidential-determination-no-87-10-assistance-for-the-nicaraguan-democratic-resistance,Ronald Reagan
"Mar 06, 1987",Proclamation 5617—Amending the Generalized System of Preferences,https://www.presidency.ucsb.edu/documents/proclamation-5617-amending-the-generalized-system-preferences,Ronald Reagan
"Mar 07, 1987",Radio Address to the Nation on Regional Conflicts,https://www.presidency.ucsb.edu/documents/radio-address-the-nation-regional-conflicts,Ronald Reagan
"Mar 10, 1987",Statement of Administration Policy: H.J. Res. 175 - Moratorium on Contra Aid,https://www.presidency.ucsb.edu/documents/statement-administration-policy-hj-res-175-moratorium-contra-aid,Ronald Reagan
"Mar 13, 1987",Statement of Administration Policy: S.J. Res. 81 - Disapproving the Provision of Additional Assistance to the Nicaraguan Democratic Resistance,https://www.presidency.ucsb.edu/documents/statement-administration-policy-sj-res-81-disapproving-the-provision-additional-assistance,Ronald Reagan
"Mar 19, 1987",The President's News Conference,https://www.presidency.ucsb.edu/documents/the-presidents-news-conference-967,Ronald Reagan
"Mar 30, 1987",Remarks at the 1987 Reagan Administration Executive Forum,https://www.presidency.ucsb.edu/documents/remarks-the-1987-reagan-administration-executive-forum,Ronald Reagan
"Apr 06, 1987","Address to a Joint Session of Parliament in Ottawa, Canada",https://www.presidency.ucsb.edu/documents/address-joint-session-parliament-ottawa-canada,Ronald Reagan
"Apr 08, 1987",Statement by Assistant to the President for Press Relations Fitzwater on the Iran Arms and Contra Aid Controversy Investigations,https://www.presidency.ucsb.edu/documents/statement-assistant-the-president-for-press-relations-fitzwater-the-iran-arms-and-contra-0,Ronald Reagan
"Apr 10, 1987",Remarks and a Question-and-Answer Session at a Los Angeles World Affairs Council Luncheon in California,https://www.presidency.ucsb.edu/documents/remarks-and-question-and-answer-session-los-angeles-world-affairs-council-luncheon,Ronald Reagan
"Apr 18, 1987",Radio Address to the Nation on Soviet-United States Relations,https://www.presidency.ucsb.edu/documents/radio-address-the-nation-soviet-united-states-relations-3,Ronald Reagan
"Apr 21, 1987",Notice of the Continuation of the National Emergency With Respect to Nicaragua,https://www.presidency.ucsb.edu/documents/notice-the-continuation-the-national-emergency-with-respect-nicaragua-2,Ronald Reagan
"Apr 21, 1987",Message to the Congress on the Continuation of the National Emergency With Respect to Nicaragua,https://www.presidency.ucsb.edu/documents/message-the-congress-the-continuation-the-national-emergency-with-respect-nicaragua-1,Ronald Reagan
"Apr 29, 1987",Remarks at the Annual Republican Congressional Fund-raising Dinner,https://www.presidency.ucsb.edu/documents/remarks-the-annual-republican-congressional-fund-raising-dinner,Ronald Reagan
"May 01, 1987",Message to the Congress Reporting on the National Emergency With Respect to Nicaragua,https://www.presidency.ucsb.edu/documents/message-the-congress-reporting-the-national-emergency-with-respect-nicaragua-0,Ronald Reagan
"May 03, 1987","Remarks to the 100th Annual Convention of the American Newspaper Publishers Association in New York, New York",https://www.presidency.ucsb.edu/documents/remarks-the-100th-annual-convention-the-american-newspaper-publishers-association-new-york,Ronald Reagan
"May 12, 1987",Remarks at a White House Briefing for Members of the Council of the Americas,https://www.presidency.ucsb.edu/documents/remarks-white-house-briefing-for-members-the-council-the-americas,Ronald Reagan
"May 13, 1987",Remarks Following Meetings With President Vinicio Cerezo Arevalo of Guatemala,https://www.presidency.ucsb.edu/documents/remarks-following-meetings-with-president-vinicio-cerezo-arevalo-guatemala,Ronald Reagan
"May 15, 1987",Remarks and a Question-and-Answer Session With Southeast Regional Editors and Broadcasters,https://www.presidency.ucsb.edu/documents/remarks-and-question-and-answer-session-with-southeast-regional-editors-and-broadcasters,Ronald Reagan
"May 27, 1987",Interview With Foreign Television Journalists Prior to the Venice Economic Summit,https://www.presidency.ucsb.edu/documents/interview-with-foreign-television-journalists-prior-the-venice-economic-summit,Ronald Reagan
"Jun 11, 1987",The President's News Conference,https://www.presidency.ucsb.edu/documents/the-presidents-news-conference-966,Ronald Reagan
"Jun 17, 1987",Statement by Assistant to the President for Press Relations Fitzwater on the Meeting Between President Reagan and President Oscar Arias Sanchez of Costa Rica,https://www.presidency.ucsb.edu/documents/statement-assistant-the-president-for-press-relations-fitzwater-the-meeting-between,Ronald Reagan
"Jun 17, 1987",Remarks at a Fundraising Reception for Senator Orrin G. Hatch of Utah,https://www.presidency.ucsb.edu/documents/remarks-fundraising-reception-for-senator-orrin-g-hatch-utah,Ronald Reagan
"Jun 29, 1987",Remarks at a White House Briefing for Administration Supporters,https://www.presidency.ucsb.edu/documents/remarks-white-house-briefing-for-administration-supporters,Ronald Reagan
"Jul 17, 1987","Proclamation 5680—Captive Nations Week, 1987",https://www.presidency.ucsb.edu/documents/proclamation-5680-captive-nations-week-1987,Ronald Reagan
"Jul 18, 1987",Radio Address to the Nation on United States Assistance for the Nicaraguan Democratic Resistance,https://www.presidency.ucsb.edu/documents/radio-address-the-nation-united-states-assistance-for-the-nicaraguan-democratic-2,Ronald Reagan
"Jul 24, 1987",Remarks to Captive Nations Conference Participants,https://www.presidency.ucsb.edu/documents/remarks-captive-nations-conference-participants,Ronald Reagan
"Aug 03, 1987",Remarks on Receiving the Report of the Presidential Task Force on Project Economic Justice,https://www.presidency.ucsb.edu/documents/remarks-receiving-the-report-the-presidential-task-force-project-economic-justice,Ronald Reagan
"Aug 05, 1987",Remarks to Reporters Announcing the Central American Peace Initiative,https://www.presidency.ucsb.edu/documents/remarks-reporters-announcing-the-central-american-peace-initiative,Ronald Reagan
"Aug 08, 1987",Radio Address to the Nation on the 26th Anniversary of the Berlin Wall,https://www.presidency.ucsb.edu/documents/radio-address-the-nation-the-26th-anniversary-the-berlin-wall,Ronald Reagan
"Aug 08, 1987",Statement on the Central American Peace Agreement,https://www.presidency.ucsb.edu/documents/statement-the-central-american-peace-agreement,Ronald Reagan
