filename,date,title,president,url,source
doc_106.txt,25-Oct-84,Interview With Representatives of the Scripps-Howard News Service,Ronald Reagan,https://www.presidency.ucsb.edu/documents/interview-with-representatives-the-scripps-howard-news-service,UCSB Presidency Project
doc_107.txt,26-Oct-84,"Remarks at a Reagan-Bush Rally in Fairfield, Connecticut",Ronald Reagan,https://www.presidency.ucsb.edu/documents/remarks-reagan-bush-rally-fairfield-connecticut,UCSB Presidency Project
doc_108.txt,26-Oct-84,"Remarks at a Reagan-Bush Rally in Hackensack, New Jersey",Ronald Reagan,https://www.presidency.ucsb.edu/documents/remarks-reagan-bush-rally-hackensack-new-jersey,UCSB Presidency Project
doc_109.txt,29-Oct-84,"Remarks at a Reagan-Bush Rally in Millersville, Pennsylvania",Ronald Reagan,https://www.presidency.ucsb.edu/documents/remarks-reagan-bush-rally-millersville-pennsylvania,UCSB Presidency Project
doc_110.txt,29-Oct-84,"Remarks at a Reagan-Bush Rally in Media, Pennsylvania",Ronald Reagan,https://www.presidency.ucsb.edu/documents/remarks-reagan-bush-rally-media-pennsylvania,UCSB Presidency Project
doc_111.txt,29-Oct-84,"Remarks at a Reagan-Bush Rally in Parkersburg, West Virginia",Ronald Reagan,https://www.presidency.ucsb.edu/documents/remarks-reagan-bush-rally-parkersburg-west-virginia,UCSB Presidency Project
doc_112.txt,30-Oct-84,Interview With Editors of the Hearst Corporation,Ronald Reagan,https://www.presidency.ucsb.edu/documents/interview-with-editors-the-hearst-corporation,UCSB Presidency Project
doc_113.txt,3-Nov-84,"Informal Exchange With Reporters in Winterset, Iowa",Ronald Reagan,https://www.presidency.ucsb.edu/documents/informal-exchange-with-reporters-winterset-iowa,UCSB Presidency Project
doc_114.txt,4-Nov-84,"Remarks and a Question-and-Answer Session With Reporters in Rochester, Minnesota",Ronald Reagan,https://www.presidency.ucsb.edu/documents/remarks-and-question-and-answer-session-with-reporters-rochester-minnesota,UCSB Presidency Project
doc_115.txt,7-Nov-84,Question-and-Answer Session With Reporters on Foreign and Domestic Issues,Ronald Reagan,https://www.presidency.ucsb.edu/documents/question-and-answer-session-with-reporters-foreign-and-domestic-issues,UCSB Presidency Project
doc_116.txt,9-Nov-84,Statement on Signing the Intelligence Authorization Act for Fiscal Year 1985,Ronald Reagan,https://www.presidency.ucsb.edu/documents/statement-signing-the-intelligence-authorization-act-for-fiscal-year-1985,UCSB Presidency Project
doc_117.txt,27-Nov-84,Interview With Representatives of the Washington Times,Ronald Reagan,https://www.presidency.ucsb.edu/documents/interview-with-representatives-the-washington-times,UCSB Presidency Project
doc_118.txt,4-Dec-84,Remarks at the Welcoming Ceremony for President Jaime Lusinchi of Venezuela,Ronald Reagan,https://www.presidency.ucsb.edu/documents/remarks-the-welcoming-ceremony-for-president-jaime-lusinchi-venezuela,UCSB Presidency Project
doc_119.txt,6-Dec-84,"Interview With Tom Winter and Joseph Baldacchino, Jr., of Human Events",Ronald Reagan,https://www.presidency.ucsb.edu/documents/interview-with-tom-winter-and-joseph-baldacchino-jr-human-events,UCSB Presidency Project
doc_120.txt,10-Dec-84,"Proclamation 5287—Bill of Rights Day, Human Rights Day and Week, 1984",Ronald Reagan,https://www.presidency.ucsb.edu/documents/proclamation-5287-bill-rights-day-human-rights-day-and-week-1984,UCSB Presidency Project
doc_121.txt,10-Dec-84,Remarks on Signing the International Human Rights Day Proclamation,Ronald Reagan,https://www.presidency.ucsb.edu/documents/remarks-signing-the-international-human-rights-day-proclamation,UCSB Presidency Project
doc_122.txt,9-Jan-85,The President's News Conference,Ronald Reagan,https://www.presidency.ucsb.edu/documents/the-presidents-news-conference-955,UCSB Presidency Project
doc_123.txt,26-Jan-85,Interview With Representatives of Independent Radio Networks,Ronald Reagan,https://www.presidency.ucsb.edu/documents/interview-with-representatives-independent-radio-networks,UCSB Presidency Project
doc_124.txt,6-Feb-85,Address Before a Joint Session of the Congress on the State of the Union,Ronald Reagan,https://www.presidency.ucsb.edu/documents/address-before-joint-session-the-congress-the-state-the-union-5,UCSB Presidency Project
doc_125.txt,7-Feb-85,Interview With a Group of Senior Executives and Staff Members From the Wall Street Journal,Ronald Reagan,https://www.presidency.ucsb.edu/documents/interview-with-group-senior-executives-and-staff-members-from-the-wall-street-journal,UCSB Presidency Project
doc_126.txt,11-Feb-85,Interview With Bernard Weinraub and Gerald Boyd of the New York Times,Ronald Reagan,https://www.presidency.ucsb.edu/documents/interview-with-bernard-weinraub-and-gerald-boyd-the-new-york-times,UCSB Presidency Project
doc_127.txt,16-Feb-85,Radio Address to the Nation on Central America,Ronald Reagan,https://www.presidency.ucsb.edu/documents/radio-address-the-nation-central-america-1,UCSB Presidency Project
doc_128.txt,21-Feb-85,The President's News Conference,Ronald Reagan,https://www.presidency.ucsb.edu/documents/the-presidents-news-conference-956,UCSB Presidency Project
doc_129.txt,1-Mar-85,Remarks at the Annual Dinner of the Conservative Political Action Conference,Ronald Reagan,https://www.presidency.ucsb.edu/documents/remarks-the-annual-dinner-the-conservative-political-action-conference,UCSB Presidency Project
doc_130.txt,4-Mar-85,Interview With Morton Kondracke and Richard H. Smith of Newsweek Magazine,Ronald Reagan,https://www.presidency.ucsb.edu/documents/interview-with-morton-kondracke-and-richard-h-smith-newsweek-magazine,UCSB Presidency Project
doc_131.txt,11-Mar-85,Remarks and a Question-and-Answer Session With Regional Editors and Broadcasters,Ronald Reagan,https://www.presidency.ucsb.edu/documents/remarks-and-question-and-answer-session-with-regional-editors-and-broadcasters-2,UCSB Presidency Project
doc_132.txt,14-Mar-85,Remarks and a Question-and-Answer Session During a White House Briefing for Members of the Magazine Publishers Association,Ronald Reagan,https://www.presidency.ucsb.edu/documents/remarks-and-question-and-answer-session-during-white-house-briefing-for-members-the,UCSB Presidency Project
doc_133.txt,18-Mar-85,"Toast at a Luncheon With Provincial and Community Leaders in Quebec City, Canada",Ronald Reagan,https://www.presidency.ucsb.edu/documents/toast-luncheon-with-provincial-and-community-leaders-quebec-city-canada,UCSB Presidency Project
doc_134.txt,19-Mar-85,Remarks at the Welcoming Ceremony for President Raul Alfonsin of Argentina,Ronald Reagan,https://www.presidency.ucsb.edu/documents/remarks-the-welcoming-ceremony-for-president-raul-alfonsin-argentina,UCSB Presidency Project
doc_135.txt,21-Mar-85,The President's News Conference,Ronald Reagan,https://www.presidency.ucsb.edu/documents/the-presidents-news-conference-954,UCSB Presidency Project
doc_136.txt,25-Mar-85,Remarks at a White House Briefing for Central American Leaders,Ronald Reagan,https://www.presidency.ucsb.edu/documents/remarks-white-house-briefing-for-central-american-leaders,UCSB Presidency Project
doc_137.txt,27-Mar-85,Written Responses to Questions Submitted by II Resto Del Carlino of Italy,Ronald Reagan,https://www.presidency.ucsb.edu/documents/written-responses-questions-submitted-ii-resto-del-carlino-italy,UCSB Presidency Project
doc_138.txt,30-Mar-85,Radio Address to the Nation on the Situation in Central America,Ronald Reagan,https://www.presidency.ucsb.edu/documents/radio-address-the-nation-the-situation-central-america,UCSB Presidency Project
doc_139.txt,1-Apr-85,"Interview With Lou Cannon, Dave Hoffman, and Lynn Downie of the Washington Post",Ronald Reagan,https://www.presidency.ucsb.edu/documents/interview-with-lou-cannon-dave-hoffman-and-lynn-downie-the-washington-post,UCSB Presidency Project
doc_140.txt,2-Apr-85,"Nomination of Charles A. Gillespie, Jr., To Be United States Ambassador to Colombia",Ronald Reagan,https://www.presidency.ucsb.edu/documents/nomination-charles-gillespie-jr-be-united-states-ambassador-colombia,UCSB Presidency Project
doc_141.txt,4-Apr-85,Remarks Announcing a Central American Peace Proposal and a Question-and-Answer Session With Reporters,Ronald Reagan,https://www.presidency.ucsb.edu/documents/remarks-announcing-central-american-peace-proposal-and-question-and-answer-session-with,UCSB Presidency Project
doc_142.txt,4-Apr-85,Remarks Following Discussions With President Belisario Betancur Cuartas of Colombia,Ronald Reagan,https://www.presidency.ucsb.edu/documents/remarks-following-discussions-with-president-belisario-betancur-cuartas-colombia,UCSB Presidency Project
doc_143.txt,4-Apr-85,"Remarks in an Interview With Nicholas Ashford and Charles Douglas-Home of the Times of London, Together With Written Responses to Questions",Ronald Reagan,https://www.presidency.ucsb.edu/documents/remarks-interview-with-nicholas-ashford-and-charles-douglas-home-the-times-london-together,UCSB Presidency Project
doc_144.txt,4-Apr-85,"Letter to the Presidents of Colombia, Mexico, Panama, and Venezuela on the Central American Peace Proposal",Ronald Reagan,https://www.presidency.ucsb.edu/documents/letter-the-presidents-colombia-mexico-panama-and-venezuela-the-central-american-peace,UCSB Presidency Project
doc_145.txt,5-Apr-85,Informal Exchange With Reporters,Ronald Reagan,https://www.presidency.ucsb.edu/documents/informal-exchange-with-reporters-6,UCSB Presidency Project
doc_146.txt,6-Apr-85,Radio Address to the Nation on the Federal Budget and the Central American Peace Proposal,Ronald Reagan,https://www.presidency.ucsb.edu/documents/radio-address-the-nation-the-federal-budget-and-the-central-american-peace-proposal,UCSB Presidency Project
doc_147.txt,15-Apr-85,Statement of Administration Policy: S.J. Res. 106 - Approving The Obligation Of Funds For Operations In Nicaragua,Ronald Reagan,https://www.presidency.ucsb.edu/documents/statement-administration-policy-sj-res-106-approving-the-obligation-funds-for-operations,UCSB Presidency Project
doc_148.txt,15-Apr-85,Remarks to Reporters on the Central American Peace Proposal,Ronald Reagan,https://www.presidency.ucsb.edu/documents/remarks-reporters-the-central-american-peace-proposal,UCSB Presidency Project
doc_149.txt,15-Apr-85,Remarks at a Fund-raising Dinner for the Nicaragua Refugee Fund,Ronald Reagan,https://www.presidency.ucsb.edu/documents/remarks-fund-raising-dinner-for-the-nicaragua-refugee-fund,UCSB Presidency Project
doc_150.txt,16-Apr-85,Remarks at a Conference on Religious Liberty,Ronald Reagan,https://www.presidency.ucsb.edu/documents/remarks-conference-religious-liberty,UCSB Presidency Project
doc_151.txt,16-Apr-85,Remarks at a White House Meeting with the Deficit Reduction Coalition,Ronald Reagan,https://www.presidency.ucsb.edu/documents/remarks-white-house-meeting-with-the-deficit-reduction-coalition,UCSB Presidency Project
doc_152.txt,18-Apr-85,Statement of Administration Policy: H.J. Res. 239 - Approving The Obligation Of Funds For Operations In Nicaragua,Ronald Reagan,https://www.presidency.ucsb.edu/documents/statement-administration-policy-hj-res-239-approving-the-obligation-funds-for-operations,UCSB Presidency Project
doc_153.txt,18-Apr-85,Remarks and a Question-and-Answer Session With Regional Editors and Broadcasters,Ronald Reagan,https://www.presidency.ucsb.edu/documents/remarks-and-question-and-answer-session-with-regional-editors-and-broadcasters-1,UCSB Presidency Project
doc_154.txt,18-Apr-85,Written Responses to Questions Submitted by ABC of Spain,Ronald Reagan,https://www.presidency.ucsb.edu/documents/written-responses-questions-submitted-abc-spain,UCSB Presidency Project
doc_155.txt,20-Apr-85,Radio Address to the Nation on the Central American Peace Proposal,Ronald Reagan,https://www.presidency.ucsb.edu/documents/radio-address-the-nation-the-central-american-peace-proposal,UCSB Presidency Project
doc_156.txt,23-Apr-85,Statement on Senate Approval of United States Assistance for the Nicaraguan Democratic Resistance,Ronald Reagan,https://www.presidency.ucsb.edu/documents/statement-senate-approval-united-states-assistance-for-the-nicaraguan-democratic,UCSB Presidency Project
doc_157.txt,23-Apr-85,Letter to Senate Majority Leader Dole on the Central American Peace Proposal and United States Assistance for the Nicaraguan Democratic Resistance,Ronald Reagan,https://www.presidency.ucsb.edu/documents/letter-senate-majority-leader-dole-the-central-american-peace-proposal-and-united-states,UCSB Presidency Project
doc_158.txt,24-Apr-85,Statement on House of Representatives Disapproval of United States Assistance for the Nicaraguan Democratic Resistance,Ronald Reagan,https://www.presidency.ucsb.edu/documents/statement-house-representatives-disapproval-united-states-assistance-for-the-nicaraguan,UCSB Presidency Project
doc_159.txt,25-Apr-85,Written Responses to Questions Submitted by La Vanguardia of Spain,Ronald Reagan,https://www.presidency.ucsb.edu/documents/written-responses-questions-submitted-la-vanguardia-spain,UCSB Presidency Project
doc_160.txt,29-Apr-85,Interview With Foreign Journalists,Ronald Reagan,https://www.presidency.ucsb.edu/documents/interview-with-foreign-journalists-3,UCSB Presidency Project
doc_161.txt,29-Apr-85,Written Responses to Questions Submitted by El Pais of Spain,Ronald Reagan,https://www.presidency.ucsb.edu/documents/written-responses-questions-submitted-el-pais-spain,UCSB Presidency Project
doc_162.txt,1-May-85,Statement by Principal Deputy Press Secretary Speakes on Economic Sanctions Against Nicaragua,Ronald Reagan,https://www.presidency.ucsb.edu/documents/statement-principal-deputy-press-secretary-speakes-economic-sanctions-against-nicaragua,UCSB Presidency Project
doc_163.txt,1-May-85,Executive Order 12513—Prohibiting Trade and Certain Other Transactions Involving Nicaragua,Ronald Reagan,https://www.presidency.ucsb.edu/documents/executive-order-12513-prohibiting-trade-and-certain-other-transactions-involving-nicaragua,UCSB Presidency Project
doc_164.txt,1-May-85,Message to the Congress on Economic Sanctions Against Nicaragua,Ronald Reagan,https://www.presidency.ucsb.edu/documents/message-the-congress-economic-sanctions-against-nicaragua,UCSB Presidency Project
doc_165.txt,4-May-85,Radio Address to the Nation on the Bonn Economic Summit,Ronald Reagan,https://www.presidency.ucsb.edu/documents/radio-address-the-nation-the-bonn-economic-summit,UCSB Presidency Project
doc_166.txt,5-May-85,Remarks at a Joint German-American Military Ceremony at Bitburg Air Base in the Federal Republic of Germany,Ronald Reagan,https://www.presidency.ucsb.edu/documents/remarks-joint-german-american-military-ceremony-bitburg-air-base-the-federal-republic,UCSB Presidency Project
doc_167.txt,7-May-85,"Remarks to Community Leaders in Madrid, Spain",Ronald Reagan,https://www.presidency.ucsb.edu/documents/remarks-community-leaders-madrid-spain,UCSB Presidency Project
doc_168.txt,8-May-85,"Address to a Special Session of the European Parliament in Strasbourg, France",Ronald Reagan,https://www.presidency.ucsb.edu/documents/address-special-session-the-european-parliament-strasbourg-france,UCSB Presidency Project
doc_169.txt,10-May-85,The President's News Conference,Ronald Reagan,https://www.presidency.ucsb.edu/documents/the-presidents-news-conference-953,UCSB Presidency Project
doc_170.txt,16-May-85,Remarks Following Discussions With President Jose Napoleon Duarte of El Salvador,Ronald Reagan,https://www.presidency.ucsb.edu/documents/remarks-following-discussions-with-president-jose-napoleon-duarte-el-salvador,UCSB Presidency Project
doc_171.txt,16-May-85,Remarks at the Annual Republican Senate/House Fund-raising Dinner,Ronald Reagan,https://www.presidency.ucsb.edu/documents/remarks-the-annual-republican-senatehouse-fund-raising-dinner,UCSB Presidency Project
doc_172.txt,17-May-85,Remarks at the Convention of the National Republican Heritage Groups Council,Ronald Reagan,https://www.presidency.ucsb.edu/documents/remarks-the-convention-the-national-republican-heritage-groups-council,UCSB Presidency Project
doc_173.txt,18-May-85,Radio Address to the Nation on Armed Forces Day and Defense Spending,Ronald Reagan,https://www.presidency.ucsb.edu/documents/radio-address-the-nation-armed-forces-day-and-defense-spending,UCSB Presidency Project
doc_174.txt,21-May-85,Informal Exchange With Reporters Prior to a Meeting Between President Reagan and President Roberto Suazo Cordova of Honduras,Ronald Reagan,https://www.presidency.ucsb.edu/documents/informal-exchange-with-reporters-prior-meeting-between-president-reagan-and-president,UCSB Presidency Project
doc_175.txt,21-May-85,Remarks at the Annual Conference of the Council of the Americas,Ronald Reagan,https://www.presidency.ucsb.edu/documents/remarks-the-annual-conference-the-council-the-americas,UCSB Presidency Project
doc_176.txt,21-May-85,Remarks Following Discussions With President Roberto Suazo Cordova of Honduras,Ronald Reagan,https://www.presidency.ucsb.edu/documents/remarks-following-discussions-with-president-roberto-suazo-cordova-honduras,UCSB Presidency Project
doc_177.txt,24-May-85,Remarks at the Annual Meeting of the National Association of Manufacturers,Ronald Reagan,https://www.presidency.ucsb.edu/documents/remarks-the-annual-meeting-the-national-association-manufacturers-0,UCSB Presidency Project
doc_178.txt,27-May-85,"Remarks at a Fund-raising Dinner for Senator Paula Hawkins in Miami, Florida",Ronald Reagan,https://www.presidency.ucsb.edu/documents/remarks-fund-raising-dinner-for-senator-paula-hawkins-miami-florida,UCSB Presidency Project
doc_179.txt,5-Jun-85,"Remarks at a Fund-raising Luncheon for Senator Don Nickles in Oklahoma City, Oklahoma",Ronald Reagan,https://www.presidency.ucsb.edu/documents/remarks-fund-raising-luncheon-for-senator-don-nickles-oklahoma-city-oklahoma,UCSB Presidency Project
doc_180.txt,5-Jun-85,"Remarks at a Fund-raising Dinner for Senator Mack Mattingly in Atlanta, Georgia",Ronald Reagan,https://www.presidency.ucsb.edu/documents/remarks-fund-raising-dinner-for-senator-mack-mattingly-atlanta-georgia,UCSB Presidency Project
doc_181.txt,6-Jun-85,"Remarks at a Fund-raising Luncheon for Senator Jeremiah Denton in Birmingham, Alabama",Ronald Reagan,https://www.presidency.ucsb.edu/documents/remarks-fund-raising-luncheon-for-senator-jeremiah-denton-birmingham-alabama,UCSB Presidency Project
doc_182.txt,8-Jun-85,Radio Address to the Nation on United States Assistance for the Nicaraguan Democratic Resistance,Ronald Reagan,https://www.presidency.ucsb.edu/documents/radio-address-the-nation-united-states-assistance-for-the-nicaraguan-democratic-resistance,UCSB Presidency Project
doc_183.txt,12-Jun-85,Statement on House of Representatives Approval of United States Assistance for the Nicaraguan Democratic Resistance,Ronald Reagan,https://www.presidency.ucsb.edu/documents/statement-house-representatives-approval-united-states-assistance-for-the-nicaraguan,UCSB Presidency Project
doc_184.txt,14-Jun-85,"Remarks at a Flag Day Ceremony in Baltimore, Maryland",Ronald Reagan,https://www.presidency.ucsb.edu/documents/remarks-flag-day-ceremony-baltimore-maryland,UCSB Presidency Project
doc_185.txt,20-Jun-85,Statement Announcing Actions Against Terrorism,Ronald Reagan,https://www.presidency.ucsb.edu/documents/statement-announcing-actions-against-terrorism,UCSB Presidency Project
doc_186.txt,8-Jul-85,Remarks at the Annual Convention of the American Bar Association,Ronald Reagan,https://www.presidency.ucsb.edu/documents/remarks-the-annual-convention-the-american-bar-association,UCSB Presidency Project
doc_187.txt,5-Aug-85,Remarks and a Question-and-Answer Session With Reporters,Ronald Reagan,https://www.presidency.ucsb.edu/documents/remarks-and-question-and-answer-session-with-reporters-0,UCSB Presidency Project
doc_188.txt,8-Aug-85,Statement on Signing the International Security and Development Cooperation Act of 1985,Ronald Reagan,https://www.presidency.ucsb.edu/documents/statement-signing-the-international-security-and-development-cooperation-act-1985,UCSB Presidency Project
doc_189.txt,22-Aug-85,Remarks at a California Republican Party Fund-raising Dinner in Los Angeles,Ronald Reagan,https://www.presidency.ucsb.edu/documents/remarks-california-republican-party-fund-raising-dinner-los-angeles,UCSB Presidency Project
doc_190.txt,24-Aug-85,"Telephone Interview With Tomas Regalado of WRHC Radio in Miami, Florida",Ronald Reagan,https://www.presidency.ucsb.edu/documents/telephone-interview-with-tomas-regalado-wrhc-radio-miami-florida,UCSB Presidency Project
doc_191.txt,30-Aug-85,Statement on the Establishment of the Nicaraguan Humanitarian Assistance Office,Ronald Reagan,https://www.presidency.ucsb.edu/documents/statement-the-establishment-the-nicaraguan-humanitarian-assistance-office,UCSB Presidency Project
doc_192.txt,9-Sep-85,Interview With Representatives of College Radio Stations,Ronald Reagan,https://www.presidency.ucsb.edu/documents/interview-with-representatives-college-radio-stations,UCSB Presidency Project
doc_193.txt,13-Sep-85,Interview With Guillermo Descalzi of the Spanish International Network,Ronald Reagan,https://www.presidency.ucsb.edu/documents/interview-with-guillermo-descalzi-the-spanish-international-network,UCSB Presidency Project
doc_194.txt,16-Sep-85,Remarks and a Question-and-Answer Session With Regional Editors and Broadcasters,Ronald Reagan,https://www.presidency.ucsb.edu/documents/remarks-and-question-and-answer-session-with-regional-editors-and-broadcasters,UCSB Presidency Project
doc_195.txt,7-Oct-85,Remarks at a White House Meeting With Reagan-Bush Campaign Leadership Groups,Ronald Reagan,https://www.presidency.ucsb.edu/documents/remarks-white-house-meeting-with-reagan-bush-campaign-leadership-groups,UCSB Presidency Project
doc_196.txt,24-Oct-85,"Address to the 40th Session of the United Nations General Assembly in New York, New York",Ronald Reagan,https://www.presidency.ucsb.edu/documents/address-the-40th-session-the-united-nations-general-assembly-new-york-new-york,UCSB Presidency Project
doc_197.txt,26-Oct-85,Radio Address to the Nation on International Stability,Ronald Reagan,https://www.presidency.ucsb.edu/documents/radio-address-the-nation-international-stability,UCSB Presidency Project
doc_198.txt,29-Oct-85,Interview With Brian Widlake of the British Broadcasting Corporation,Ronald Reagan,https://www.presidency.ucsb.edu/documents/interview-with-brian-widlake-the-british-broadcasting-corporation,UCSB Presidency Project
doc_199.txt,31-Oct-85,Message to the Congress Reporting on Economic Sanctions Against Nicaragua,Ronald Reagan,https://www.presidency.ucsb.edu/documents/message-the-congress-reporting-economic-sanctions-against-nicaragua,UCSB Presidency Project
doc_200.txt,6-Nov-85,Interview With Representatives of the Wire Services,Ronald Reagan,https://www.presidency.ucsb.edu/documents/interview-with-representatives-the-wire-services,UCSB Presidency Project
doc_201.txt,12-Nov-85,Interview With Foreign Broadcasters on the Upcoming Soviet- United States Summit Meeting in Geneva,Ronald Reagan,https://www.presidency.ucsb.edu/documents/interview-with-foreign-broadcasters-the-upcoming-soviet-united-states-summit-meeting,UCSB Presidency Project
doc_202.txt,14-Nov-85,Letter to Congressional Leaders Transmitting a Report on the Central American Conflict,Ronald Reagan,https://www.presidency.ucsb.edu/documents/letter-congressional-leaders-transmitting-report-the-central-american-conflict,UCSB Presidency Project
doc_203.txt,14-Nov-85,Written Responses to Questions Submitted by Japanese Journalists on the Upcoming Soviet-United States Summit Meeting in Geneva,Ronald Reagan,https://www.presidency.ucsb.edu/documents/written-responses-questions-submitted-japanese-journalists-the-upcoming-soviet-united,UCSB Presidency Project
doc_204.txt,14-Nov-85,Appointment of Four Members of the National Advisory Council on Continuing Education,Ronald Reagan,https://www.presidency.ucsb.edu/documents/appointment-four-members-the-national-advisory-council-continuing-education-0,UCSB Presidency Project
doc_205.txt,14-Nov-85,Address to the Nation on the Upcoming Soviet-United States Summit Meeting in Geneva,Ronald Reagan,https://www.presidency.ucsb.edu/documents/address-the-nation-the-upcoming-soviet-united-states-summit-meeting-geneva,UCSB Presidency Project
doc_206.txt,21-Nov-85,Address Before a Joint Session of the Congress Following the Soviet-United States Summit Meeting in Geneva,Ronald Reagan,https://www.presidency.ucsb.edu/documents/address-before-joint-session-the-congress-following-the-soviet-united-states-summit,UCSB Presidency Project
doc_207.txt,4-Dec-85,Statement on Signing the Intelligence Authorization Act for Fiscal Year 1986,Ronald Reagan,https://www.presidency.ucsb.edu/documents/statement-signing-the-intelligence-authorization-act-for-fiscal-year-1986,UCSB Presidency Project
doc_208.txt,4-Dec-85,"Question-and-Answer Session With Students at Fallston High School in Fallston, Maryland",Ronald Reagan,https://www.presidency.ucsb.edu/documents/question-and-answer-session-with-students-fallston-high-school-fallston-maryland,UCSB Presidency Project
doc_209.txt,4-Dec-85,Letter Accepting the Resignation of Robert C. McFarlane as Assistant to the President for National Security Affairs,Ronald Reagan,https://www.presidency.ucsb.edu/documents/letter-accepting-the-resignation-robert-c-mcfarlane-assistant-the-president-for-national,UCSB Presidency Project
doc_210.txt,4-Dec-85,Remarks Announcing the Resignation of Robert C. McFarlane as Assistant to the President for National Security Affairs and the Appointment of John M. Poindexter,Ronald Reagan,https://www.presidency.ucsb.edu/documents/remarks-announcing-the-resignation-robert-c-mcfarlane-assistant-the-president-for-national,UCSB Presidency Project
