filename,date,title,president,url,source
doc_211.txt,10-Dec-85,Remarks on Signing the Bill of Rights Day and the Human Rights Day and Week Proclamation,Ronald Reagan,https://www.presidency.ucsb.edu/documents/remarks-signing-the-bill-rights-day-and-the-human-rights-day-and-week-proclamation,UCSB Presidency Project
doc_212.txt,14-Dec-85,Radio Address to the Nation on Tax Reform and the Situation in Nicaragua,Ronald Reagan,https://www.presidency.ucsb.edu/documents/radio-address-the-nation-tax-reform-and-the-situation-nicaragua,UCSB Presidency Project
doc_213.txt,21-Dec-85,Radio Address to the Nation on the Major Legislative Achievements of 1985,Ronald Reagan,https://www.presidency.ucsb.edu/documents/radio-address-the-nation-the-major-legislative-achievements-1985,UCSB Presidency Project
doc_214.txt,2-Jan-86,Written Responses to Questions Submitted by Noticias de Mexico,Ronald Reagan,https://www.presidency.ucsb.edu/documents/written-responses-questions-submitted-noticias-de-mexico,UCSB Presidency Project
doc_215.txt,4-Jan-86,Radio Address to the Nation on Relations With Mexico and Canada,Ronald Reagan,https://www.presidency.ucsb.edu/documents/radio-address-the-nation-relations-with-mexico-and-canada,UCSB Presidency Project
doc_216.txt,7-Jan-86,The President's News Conference.,Ronald Reagan,https://www.presidency.ucsb.edu/documents/the-presidents-news-conference-961,UCSB Presidency Project
doc_217.txt,30-Jan-86,Remarks at the Annual Dinner of the Conservative Political Action Conference,Ronald Reagan,https://www.presidency.ucsb.edu/documents/remarks-the-annual-dinner-the-conservative-political-action-conference-0,UCSB Presidency Project
doc_218.txt,4-Feb-86,Address Before a Joint Session of Congress on the State of the Union,Ronald Reagan,https://www.presidency.ucsb.edu/documents/address-before-joint-session-congress-the-state-the-union,UCSB Presidency Project
doc_219.txt,6-Feb-86,Remarks at the 1986 Reagan Administration Executive Forum,Ronald Reagan,https://www.presidency.ucsb.edu/documents/remarks-the-1986-reagan-administration-executive-forum,UCSB Presidency Project
doc_220.txt,6-Feb-86,Remarks on Signing the Message on America's Agenda for the Future and the Annual Economic Report of the President,Ronald Reagan,https://www.presidency.ucsb.edu/documents/remarks-signing-the-message-americas-agenda-for-the-future-and-the-annual-economic-report,UCSB Presidency Project
doc_221.txt,6-Feb-86,Message to the Congress on America's Agenda for the Future,Ronald Reagan,https://www.presidency.ucsb.edu/documents/message-the-congress-americas-agenda-for-the-future,UCSB Presidency Project
doc_222.txt,6-Feb-86,Remarks at the Annual National Prayer Breakfast,Ronald Reagan,https://www.presidency.ucsb.edu/documents/remarks-the-annual-national-prayer-breakfast-5,UCSB Presidency Project
doc_223.txt,10-Feb-86,Interview With Lou Cannon and David Hoffman of the Washington Post,Ronald Reagan,https://www.presidency.ucsb.edu/documents/interview-with-lou-cannon-and-david-hoffman-the-washington-post,UCSB Presidency Project
doc_224.txt,10-Feb-86,Remarks and a Question-and-Answer Session With Regional Editors and Broadcasters,Ronald Reagan,https://www.presidency.ucsb.edu/documents/remarks-and-question-and-answer-session-with-regional-editors-and-broadcasters-3,UCSB Presidency Project
doc_225.txt,18-Feb-86,Remarks and an Informal Exchange With Reporters on United States Assistance for the Nicaraguan Democratic Resistance,Ronald Reagan,https://www.presidency.ucsb.edu/documents/remarks-and-informal-exchange-with-reporters-united-states-assistance-for-the-nicaraguan,UCSB Presidency Project
doc_226.txt,18-Feb-86,Written Responses to Questions Submitted by Caribbean Journalists,Ronald Reagan,https://www.presidency.ucsb.edu/documents/written-responses-questions-submitted-caribbean-journalists,UCSB Presidency Project
doc_227.txt,19-Feb-86,Message to the Congress Transmitting the Annual Report of the National Endowment for Democracy,Ronald Reagan,https://www.presidency.ucsb.edu/documents/message-the-congress-transmitting-the-annual-report-the-national-endowment-for-democracy,UCSB Presidency Project
doc_228.txt,20-Feb-86,"Remarks to Citizens in St. George's, Grenada",Ronald Reagan,https://www.presidency.ucsb.edu/documents/remarks-citizens-st-georges-grenada,UCSB Presidency Project
doc_229.txt,22-Feb-86,Radio Address to the Nation on Grenada and Nicaragua,Ronald Reagan,https://www.presidency.ucsb.edu/documents/radio-address-the-nation-grenada-and-nicaragua,UCSB Presidency Project
doc_230.txt,25-Feb-86,Message to the Congress Transmitting a Request for Assistance for the Nicaraguan Democratic Resistance,Ronald Reagan,https://www.presidency.ucsb.edu/documents/message-the-congress-transmitting-request-for-assistance-for-the-nicaraguan-democratic,UCSB Presidency Project
doc_231.txt,26-Feb-86,Address to the Nation on National Security,Ronald Reagan,https://www.presidency.ucsb.edu/documents/address-the-nation-national-security,UCSB Presidency Project
doc_232.txt,3-Mar-86,Remarks at a White House Meeting for Supporters of United States Assistance for the Nicaraguan Democratic Resistance,Ronald Reagan,https://www.presidency.ucsb.edu/documents/remarks-white-house-meeting-for-supporters-united-states-assistance-for-the-nicaraguan,UCSB Presidency Project
doc_233.txt,5-Mar-86,Statement by Principal Deputy Press Secretary Speakes on the Conflict in Central America,Ronald Reagan,https://www.presidency.ucsb.edu/documents/statement-principal-deputy-press-secretary-speakes-the-conflict-central-america,UCSB Presidency Project
doc_234.txt,5-Mar-86,Remarks to Jewish Leaders During a White House Briefing on United States Assistance for the Nicaraguan Democratic Resistance,Ronald Reagan,https://www.presidency.ucsb.edu/documents/remarks-jewish-leaders-during-white-house-briefing-united-states-assistance-for-the,UCSB Presidency Project
doc_235.txt,6-Mar-86,Remarks at a White House Meeting With the House Republican Whip Organization on United States Assistance for the Nicaraguan Democratic Resistance,Ronald Reagan,https://www.presidency.ucsb.edu/documents/remarks-white-house-meeting-with-the-house-republican-whip-organization-united-states,UCSB Presidency Project
doc_236.txt,7-Mar-86,Remarks and a Question-and-Answer Session With Reporters on Announcing the Appointment of Philip C. Habib as Special Envoy for Central America,Ronald Reagan,https://www.presidency.ucsb.edu/documents/remarks-and-question-and-answer-session-with-reporters-announcing-the-appointment-philip-c,UCSB Presidency Project
doc_237.txt,8-Mar-86,Radio Address to the Nation on United States Assistance for the Nicaraguan Democratic Resistance,Ronald Reagan,https://www.presidency.ucsb.edu/documents/radio-address-the-nation-united-states-assistance-for-the-nicaraguan-democratic-0,UCSB Presidency Project
doc_238.txt,10-Mar-86,Remarks at a White House Briefing for Supporters of United States Assistance for the Nicaraguan Democratic Resistance,Ronald Reagan,https://www.presidency.ucsb.edu/documents/remarks-white-house-briefing-for-supporters-united-states-assistance-for-the-nicaraguan-0,UCSB Presidency Project
doc_239.txt,11-Mar-86,Remarks and a Question-and-Answer Session With Regional Editors and Broadcasters on United States Assistance for the Nicaraguan Democratic Resistance,Ronald Reagan,https://www.presidency.ucsb.edu/documents/remarks-and-question-and-answer-session-with-regional-editors-and-broadcasters-united,UCSB Presidency Project
doc_240.txt,12-Mar-86,Informal Exchange With Reporters Prior to Special Envoy Philip C. Habib's Departure for Central America,Ronald Reagan,https://www.presidency.ucsb.edu/documents/informal-exchange-with-reporters-prior-special-envoy-philip-c-habibs-departure-for-central,UCSB Presidency Project
doc_241.txt,12-Mar-86,Interview With Representatives of the Baltimore Sun,Ronald Reagan,https://www.presidency.ucsb.edu/documents/interview-with-representatives-the-baltimore-sun,UCSB Presidency Project
doc_242.txt,13-Mar-86,Remarks at an Exhibit of Weapons Captured in Central America,Ronald Reagan,https://www.presidency.ucsb.edu/documents/remarks-exhibit-weapons-captured-central-america,UCSB Presidency Project
doc_243.txt,14-Mar-86,Remarks to Elected Officials During a White House Briefing on United States Assistance for the Nicaraguan Democratic Resistance,Ronald Reagan,https://www.presidency.ucsb.edu/documents/remarks-elected-officials-during-white-house-briefing-united-states-assistance-for-the,UCSB Presidency Project
doc_244.txt,14-Mar-86,"Message to the Congress on Freedom, Regional Security, and Global Peace",Ronald Reagan,https://www.presidency.ucsb.edu/documents/message-the-congress-freedom-regional-security-and-global-peace,UCSB Presidency Project
doc_245.txt,15-Mar-86,Radio Address to the Nation on the Situation in Nicaragua,Ronald Reagan,https://www.presidency.ucsb.edu/documents/radio-address-the-nation-the-situation-nicaragua,UCSB Presidency Project
doc_246.txt,16-Mar-86,Address to the Nation on the Situation in Nicaragua,Ronald Reagan,https://www.presidency.ucsb.edu/documents/address-the-nation-the-situation-nicaragua,UCSB Presidency Project
doc_247.txt,17-Mar-86,"Informal Exchange With Reporters Prior to a Meeting With Ambassador Philip C. Habib, Special Envoy for Central America",Ronald Reagan,https://www.presidency.ucsb.edu/documents/informal-exchange-with-reporters-prior-meeting-with-ambassador-philip-c-habib-special,UCSB Presidency Project
doc_248.txt,18-Mar-86,Informal Exchange With Reporters Prior to a Meeting With Prime Minister Brian Mulroney of Canada,Ronald Reagan,https://www.presidency.ucsb.edu/documents/informal-exchange-with-reporters-prior-meeting-with-prime-minister-brian-mulroney-canada,UCSB Presidency Project
doc_249.txt,19-Mar-86,Message to the Congress on United States Assistance for the Nicaraguan Democratic Resistance,Ronald Reagan,https://www.presidency.ucsb.edu/documents/message-the-congress-united-states-assistance-for-the-nicaraguan-democratic-resistance,UCSB Presidency Project
doc_250.txt,20-Mar-86,Statement on House of Representatives Disapproval of United States Assistance for the Nicaraguan Democratic Resistance,Ronald Reagan,https://www.presidency.ucsb.edu/documents/statement-house-representatives-disapproval-united-states-assistance-for-the-nicaraguan-0,UCSB Presidency Project
doc_251.txt,21-Mar-86,Remarks at a White House Reception for Private Sector Supporters of United States Assistance for the Nicaraguan Democratic Resistance,Ronald Reagan,https://www.presidency.ucsb.edu/documents/remarks-white-house-reception-for-private-sector-supporters-united-states-assistance-for,UCSB Presidency Project
doc_252.txt,21-Mar-86,"Interview With R.W. Apple, Jr., Gerald M. Boyd, and Bernard Weinraub of the New York Times",Ronald Reagan,https://www.presidency.ucsb.edu/documents/interview-with-rw-apple-jr-gerald-m-boyd-and-bernard-weinraub-the-new-york-times,UCSB Presidency Project
doc_253.txt,22-Mar-86,Radio Address to the Nation on United States Assistance for the Nicaraguan Democratic Resistance,Ronald Reagan,https://www.presidency.ucsb.edu/documents/radio-address-the-nation-united-states-assistance-for-the-nicaraguan-democratic-1,UCSB Presidency Project
doc_254.txt,26-Mar-86,Statement by Principal Deputy Press Secretary Speakes on the Nicaraguan Incursion Into Honduras,Ronald Reagan,https://www.presidency.ucsb.edu/documents/statement-principal-deputy-press-secretary-speakes-the-nicaraguan-incursion-into-honduras,UCSB Presidency Project
doc_255.txt,27-Mar-86,Statement on Senate Approval of United States Assistance for the Nicaraguan Democratic Resistance,Ronald Reagan,https://www.presidency.ucsb.edu/documents/statement-senate-approval-united-states-assistance-for-the-nicaraguan-democratic-1,UCSB Presidency Project
doc_256.txt,27-Mar-86,"Remarks at a Senate Campaign Fundraiser for Representative W. Henson Moore in New Orleans, Louisiana",Ronald Reagan,https://www.presidency.ucsb.edu/documents/remarks-senate-campaign-fundraiser-for-representative-w-henson-moore-new-orleans-louisiana,UCSB Presidency Project
doc_257.txt,29-Mar-86,Radio Address to the Nation on International Violence and Democratic Values,Ronald Reagan,https://www.presidency.ucsb.edu/documents/radio-address-the-nation-international-violence-and-democratic-values,UCSB Presidency Project
doc_258.txt,8-Apr-86,Statement by Principal Deputy Press Secretary Speakes on Negotiations Between the Contadora Group and Nicaragua,Ronald Reagan,https://www.presidency.ucsb.edu/documents/statement-principal-deputy-press-secretary-speakes-negotiations-between-the-contadora,UCSB Presidency Project
doc_259.txt,9-Apr-86,Remarks and a Question-and-Answer Session With the American Society of Newspaper Editors,Ronald Reagan,https://www.presidency.ucsb.edu/documents/remarks-and-question-and-answer-session-with-the-american-society-newspaper-editors,UCSB Presidency Project
doc_260.txt,9-Apr-86,The President's News Conference,Ronald Reagan,https://www.presidency.ucsb.edu/documents/the-presidents-news-conference-959,UCSB Presidency Project
doc_261.txt,14-Apr-86,Remarks at a White House Meeting with the Associated General Contractors of America,Ronald Reagan,https://www.presidency.ucsb.edu/documents/remarks-white-house-meeting-with-the-associated-general-contractors-america,UCSB Presidency Project
doc_262.txt,15-Apr-86,Remarks at a White House Meeting With Members of the American Business Conference,Ronald Reagan,https://www.presidency.ucsb.edu/documents/remarks-white-house-meeting-with-members-the-american-business-conference-0,UCSB Presidency Project
doc_263.txt,16-Apr-86,Remarks. on Signing the Law Day U.S.A. Proclamation,Ronald Reagan,https://www.presidency.ucsb.edu/documents/remarks-signing-the-law-day-usa-proclamation-0,UCSB Presidency Project
doc_264.txt,17-Apr-86,Remarks at the Annual White House Correspondents Dinner,Ronald Reagan,https://www.presidency.ucsb.edu/documents/remarks-the-annual-white-house-correspondents-dinner,UCSB Presidency Project
doc_265.txt,22-Apr-86,Notice of the Continuation of the National Emergency With Respect to Nicaragua,Ronald Reagan,https://www.presidency.ucsb.edu/documents/notice-the-continuation-the-national-emergency-with-respect-nicaragua-0,UCSB Presidency Project
doc_266.txt,22-Apr-86,Remarks at the Heritage Foundation Anniversary Dinner,Ronald Reagan,https://www.presidency.ucsb.edu/documents/remarks-the-heritage-foundation-anniversary-dinner,UCSB Presidency Project
doc_267.txt,22-Apr-86,Message to the Congress on the Continuation of the National Emergency With Respect to Nicaragua,Ronald Reagan,https://www.presidency.ucsb.edu/documents/message-the-congress-the-continuation-the-national-emergency-with-respect-nicaragua,UCSB Presidency Project
doc_268.txt,23-Apr-86,Remarks to the International Forum of the Chamber of Commerce of the United States,Ronald Reagan,https://www.presidency.ucsb.edu/documents/remarks-the-international-forum-the-chamber-commerce-the-united-states,UCSB Presidency Project
doc_269.txt,21-May-86,Remarks at the Annual Republican Senate/House Fund-raising Dinner,Ronald Reagan,https://www.presidency.ucsb.edu/documents/remarks-the-annual-republican-senatehouse-fund-raising-dinner-0,UCSB Presidency Project
doc_270.txt,22-May-86,Statement by Principal Deputy Press Secretary Speakes on the Central American Peace Negotiations,Ronald Reagan,https://www.presidency.ucsb.edu/documents/statement-principal-deputy-press-secretary-speakes-the-central-american-peace-negotiations,UCSB Presidency Project
doc_271.txt,23-May-86,Message to the Congress Reporting on the National Emergency With Respect to Nicaragua,Ronald Reagan,https://www.presidency.ucsb.edu/documents/message-the-congress-reporting-the-national-emergency-with-respect-nicaragua,UCSB Presidency Project
doc_272.txt,27-May-86,Statement by Principal Deputy Press Secretary Speakes on the Central American Summit Meeting,Ronald Reagan,https://www.presidency.ucsb.edu/documents/statement-principal-deputy-press-secretary-speakes-the-central-american-summit-meeting,UCSB Presidency Project
doc_273.txt,27-May-86,Remarks Following Discussions With President Jose Simeon Azcona Hoyo of Honduras,Ronald Reagan,https://www.presidency.ucsb.edu/documents/remarks-following-discussions-with-president-jose-simeon-azcona-hoyo-honduras,UCSB Presidency Project
doc_274.txt,6-Jun-86,Remarks at a White House Briefing for Supporters of Tax Reform and United States Assistance for the Nicaraguan Democratic Resistance,Ronald Reagan,https://www.presidency.ucsb.edu/documents/remarks-white-house-briefing-for-supporters-tax-reform-and-united-states-assistance-for,UCSB Presidency Project
doc_275.txt,9-Jun-86,Remarks to the Georgetown University Center for Strategic and International Studies on United States Assistance for the Nicaraguan Democratic Resistance,Ronald Reagan,https://www.presidency.ucsb.edu/documents/remarks-the-georgetown-university-center-for-strategic-and-international-studies-united,UCSB Presidency Project
doc_276.txt,9-Jun-86,Written Responses to Questions on Central America Submitted by Radio Marti,Ronald Reagan,https://www.presidency.ucsb.edu/documents/written-responses-questions-central-america-submitted-radio-marti,UCSB Presidency Project
doc_277.txt,10-Jun-86,Letter to Congressional Leaders Transmitting a Report on the Situation in Central America,Ronald Reagan,https://www.presidency.ucsb.edu/documents/letter-congressional-leaders-transmitting-report-the-situation-central-america,UCSB Presidency Project
doc_278.txt,11-Jun-86,The President's News Conference,Ronald Reagan,https://www.presidency.ucsb.edu/documents/the-presidents-news-conference-958,UCSB Presidency Project
doc_279.txt,13-Jun-86,Remarks and a Question-and-Answer Session at a White House Luncheon for Regional Editors and Broadcasters,Ronald Reagan,https://www.presidency.ucsb.edu/documents/remarks-and-question-and-answer-session-white-house-luncheon-for-regional-editors-and,UCSB Presidency Project
doc_280.txt,16-Jun-86,Remarks at a White House Briefing for Supporters of United States Assistance for the Nicaraguan Democratic Resistance,Ronald Reagan,https://www.presidency.ucsb.edu/documents/remarks-white-house-briefing-for-supporters-united-states-assistance-for-the-nicaraguan,UCSB Presidency Project
doc_281.txt,23-Jun-86,Statement by Principal Deputy Press Secretary Speakes on United States Assistance for the Nicaraguan Democratic Resistance,Ronald Reagan,https://www.presidency.ucsb.edu/documents/statement-principal-deputy-press-secretary-speakes-united-states-assistance-for-the,UCSB Presidency Project
doc_282.txt,23-Jun-86,Remarks in an Interview Together With Written Responses to Questions Submitted by Le Point of France,Ronald Reagan,https://www.presidency.ucsb.edu/documents/remarks-interview-together-with-written-responses-questions-submitted-le-point-france,UCSB Presidency Project
doc_283.txt,24-Jun-86,Letter to the Speaker of the House of Representatives on United States Assistance for the Nicaraguan Democratic Resistance,Ronald Reagan,https://www.presidency.ucsb.edu/documents/letter-the-speaker-the-house-representatives-united-states-assistance-for-the-nicaraguan,UCSB Presidency Project
doc_284.txt,24-Jun-86,Address to the Nation on United States Assistance for the Nicaraguan Democratic Resistance,Ronald Reagan,https://www.presidency.ucsb.edu/documents/address-the-nation-united-states-assistance-for-the-nicaraguan-democratic-resistance,UCSB Presidency Project
doc_285.txt,25-Jun-86,Statement on House of Representatives Approval of United States Assistance for the Nicaraguan Democratic Resistance,Ronald Reagan,https://www.presidency.ucsb.edu/documents/statement-house-representatives-approval-united-states-assistance-for-the-nicaraguan-0,UCSB Presidency Project
doc_286.txt,25-Jun-86,"Remarks at a Senate Campaign Fund-raising Dinner for Jim Santini in Las Vegas, Nevada",Ronald Reagan,https://www.presidency.ucsb.edu/documents/remarks-senate-campaign-fund-raising-dinner-for-jim-santini-las-vegas-nevada,UCSB Presidency Project
doc_287.txt,5-Jul-86,Radio Address to the Nation on Independence Day and the Centennial of the Statue of Liberty,Ronald Reagan,https://www.presidency.ucsb.edu/documents/radio-address-the-nation-independence-day-and-the-centennial-the-statue-liberty,UCSB Presidency Project
doc_288.txt,21-Jul-86,Remarks on Signing the Captive Nations Week Proclamation,Ronald Reagan,https://www.presidency.ucsb.edu/documents/remarks-signing-the-captive-nations-week-proclamation-0,UCSB Presidency Project
doc_289.txt,23-Jul-86,"Remarks at a Campaign Fundraiser for William Clements in Dallas, Texas",Ronald Reagan,https://www.presidency.ucsb.edu/documents/remarks-campaign-fundraiser-for-william-clements-dallas-texas,UCSB Presidency Project
doc_290.txt,23-Jul-86,"Remarks at a Republican Party Rally in Miami, Florida",Ronald Reagan,https://www.presidency.ucsb.edu/documents/remarks-republican-party-rally-miami-florida,UCSB Presidency Project
doc_291.txt,5-Aug-86,"Remarks by Telephone to the Annual Convention of the Knights of Columbus in Chicago, Illinois",Ronald Reagan,https://www.presidency.ucsb.edu/documents/remarks-telephone-the-annual-convention-the-knights-columbus-chicago-illinois,UCSB Presidency Project
doc_292.txt,12-Aug-86,The President's News Conference,Ronald Reagan,https://www.presidency.ucsb.edu/documents/the-presidents-news-conference-957,UCSB Presidency Project
doc_293.txt,13-Aug-86,Statement on Senate Approval of United States Assistance for the Nicaraguan Democratic Resistance and for Economic Development in Central America,Ronald Reagan,https://www.presidency.ucsb.edu/documents/statement-senate-approval-united-states-assistance-for-the-nicaraguan-democratic-0,UCSB Presidency Project
doc_294.txt,14-Aug-86,"Remarks in an Interview With Representatives of Excelsior of Mexico, Together With Written Responses to Questions",Ronald Reagan,https://www.presidency.ucsb.edu/documents/remarks-interview-with-representatives-excelsior-mexico-together-with-written-responses,UCSB Presidency Project
doc_295.txt,22-Sep-86,"Address to the 41st Session of the United Nations General Assembly in New York, New York",Ronald Reagan,https://www.presidency.ucsb.edu/documents/address-the-41st-session-the-united-nations-general-assembly-new-york-new-york,UCSB Presidency Project
doc_296.txt,23-Sep-86,Remarks at a White House Briefing for Private Sector Supporters of United States Defense Policies,Ronald Reagan,https://www.presidency.ucsb.edu/documents/remarks-white-house-briefing-for-private-sector-supporters-united-states-defense-policies,UCSB Presidency Project
doc_297.txt,25-Sep-86,Remarks to Members of the National Fraternal Congress of America,Ronald Reagan,https://www.presidency.ucsb.edu/documents/remarks-members-the-national-fraternal-congress-america,UCSB Presidency Project
doc_298.txt,7-Oct-86,Remarks at the Republican Governors Association Dinner,Ronald Reagan,https://www.presidency.ucsb.edu/documents/remarks-the-republican-governors-association-dinner,UCSB Presidency Project
doc_299.txt,8-Oct-86,Informal Exchange With Reporters on the Budget,Ronald Reagan,https://www.presidency.ucsb.edu/documents/informal-exchange-with-reporters-the-budget,UCSB Presidency Project
doc_300.txt,8-Oct-86,"Remarks at a Campaign Rally for Senator Mack Mattingly in Atlanta, Georgia",Ronald Reagan,https://www.presidency.ucsb.edu/documents/remarks-campaign-rally-for-senator-mack-mattingly-atlanta-georgia,UCSB Presidency Project
doc_301.txt,13-Oct-86,Address to the Nation on the Meetings With Soviet General Secretary Gorbachev in Iceland,Ronald Reagan,https://www.presidency.ucsb.edu/documents/address-the-nation-the-meetings-with-soviet-general-secretary-gorbachev-iceland,UCSB Presidency Project
doc_302.txt,22-Oct-86,Memorandum on Assistance to the Nicaraguan Democratic Resistance,Ronald Reagan,https://www.presidency.ucsb.edu/documents/memorandum-assistance-the-nicaraguan-democratic-resistance-0,UCSB Presidency Project
doc_303.txt,5-Nov-86,Remarks at a White House Briefing for Senior Staff on the Congressional and Gubernatorial Election Results,Ronald Reagan,https://www.presidency.ucsb.edu/documents/remarks-white-house-briefing-for-senior-staff-the-congressional-and-gubernatorial-election,UCSB Presidency Project
doc_304.txt,10-Nov-86,Letter to the Speaker of the House and the President of the Senate Reporting on the Nicaraguan Emergency,Ronald Reagan,https://www.presidency.ucsb.edu/documents/letter-the-speaker-the-house-and-the-president-the-senate-reporting-the-nicaraguan,UCSB Presidency Project
doc_305.txt,15-Nov-86,Radio Address to the Nation on Administration and Congressional Goals,Ronald Reagan,https://www.presidency.ucsb.edu/documents/radio-address-the-nation-administration-and-congressional-goals,UCSB Presidency Project
doc_306.txt,18-Nov-86,Remarks at the Ethics and Public Policy Center Anniversary Dinner,Ronald Reagan,https://www.presidency.ucsb.edu/documents/remarks-the-ethics-and-public-policy-center-anniversary-dinner,UCSB Presidency Project
doc_307.txt,19-Nov-86,The President's News Conference,Ronald Reagan,https://www.presidency.ucsb.edu/documents/the-presidents-news-conference-963,UCSB Presidency Project
doc_308.txt,21-Nov-86,Remarks at the Annual Senate Republican Dinner,Ronald Reagan,https://www.presidency.ucsb.edu/documents/remarks-the-annual-senate-republican-dinner,UCSB Presidency Project
doc_309.txt,2-Dec-86,Address to the Nation on the Investigation of the Iran Arms and Contra Aid Controversy,Ronald Reagan,https://www.presidency.ucsb.edu/documents/address-the-nation-the-investigation-the-iran-arms-and-contra-aid-controversy,UCSB Presidency Project
