filename,date,title,president,url,source
doc_310.txt,4-Dec-86,Remarks Following Discussions With President Oscar Arias Sanchez of Costa Rica,Ronald Reagan,https://www.presidency.ucsb.edu/documents/remarks-following-discussions-with-president-oscar-arias-sanchez-costa-rica-0,UCSB Presidency Project
doc_311.txt,10-Dec-86,"Proclamation 5589—Human Rights Day, Bill of Rights Day, and Human Rights Week, 1986",Ronald Reagan,https://www.presidency.ucsb.edu/documents/proclamation-5589-human-rights-day-bill-rights-day-and-human-rights-week-1986,UCSB Presidency Project
doc_312.txt,10-Dec-86,"Remarks on Signing the Human Rights Day, Bill of Rights Day, and Human Rights Week Proclamation",Ronald Reagan,https://www.presidency.ucsb.edu/documents/remarks-signing-the-human-rights-day-bill-rights-day-and-human-rights-week-proclamation-0,UCSB Presidency Project
doc_313.txt,27-Dec-86,Memorandum on Further Assistance to the Nicaraguan Democratic Resistance,Ronald Reagan,https://www.presidency.ucsb.edu/documents/memorandum-further-assistance-the-nicaraguan-democratic-resistance,UCSB Presidency Project
doc_314.txt,2-Jan-87,Letter to the Speaker of the House of Representatives and the President of the Senate on the Generalized System of Preferences,Ronald Reagan,https://www.presidency.ucsb.edu/documents/letter-the-speaker-the-house-representatives-and-the-president-the-senate-the-generalized,UCSB Presidency Project
doc_315.txt,2-Jan-87,Memorandum on the Generalized System of Preferences,Ronald Reagan,https://www.presidency.ucsb.edu/documents/memorandum-the-generalized-system-preferences-2,UCSB Presidency Project
doc_316.txt,5-Jan-87,Statement by Principal Deputy Press Secretary Speakes on the Iran Arms and Contra Aid Controversy,Ronald Reagan,https://www.presidency.ucsb.edu/documents/statement-principal-deputy-press-secretary-speakes-the-iran-arms-and-contra-aid-1,UCSB Presidency Project
doc_317.txt,24-Jan-87,Radio Address to the Nation on the State of the Union,Ronald Reagan,https://www.presidency.ucsb.edu/documents/radio-address-the-nation-the-state-the-union-0,UCSB Presidency Project
doc_318.txt,27-Jan-87,Address Before a Joint Session of Congress on the State of the Union,Ronald Reagan,https://www.presidency.ucsb.edu/documents/address-before-joint-session-congress-the-state-the-union-1,UCSB Presidency Project
doc_319.txt,10-Feb-87,Remarks to the Annual Leadership Conference of the American Legion,Ronald Reagan,https://www.presidency.ucsb.edu/documents/remarks-the-annual-leadership-conference-the-american-legion-0,UCSB Presidency Project
doc_320.txt,20-Feb-87,Remarks at the Conservative Political Action Conference Luncheon,Ronald Reagan,https://www.presidency.ucsb.edu/documents/remarks-the-conservative-political-action-conference-luncheon,UCSB Presidency Project
doc_321.txt,26-Feb-87,Statement of Administration Policy: S. 184 - To Provide Economic Assistance to the Central American Democracies and Disapproving Aid to the Contras,Ronald Reagan,https://www.presidency.ucsb.edu/documents/statement-administration-policy-s-184-provide-economic-assistance-the-central-american,UCSB Presidency Project
doc_322.txt,27-Feb-87,Excerpts from the Tower Commission Report,Ronald Reagan,https://www.presidency.ucsb.edu/documents/excerpts-from-the-tower-commission-report,UCSB Presidency Project
doc_323.txt,3-Mar-87,Message to the Congress on Economic Assistance for Central America,Ronald Reagan,https://www.presidency.ucsb.edu/documents/message-the-congress-economic-assistance-for-central-america,UCSB Presidency Project
doc_324.txt,3-Mar-87,Letter Accepting the Resignation of Patrick J. Buchanan as Assistant to the President and Director of Communications,Ronald Reagan,https://www.presidency.ucsb.edu/documents/letter-accepting-the-resignation-patrick-j-buchanan-assistant-the-president-and-director,UCSB Presidency Project
doc_325.txt,5-Mar-87,Presidential Determination No. 87-10 - Assistance for the Nicaraguan Democratic Resistance,Ronald Reagan,https://www.presidency.ucsb.edu/documents/presidential-determination-no-87-10-assistance-for-the-nicaraguan-democratic-resistance,UCSB Presidency Project
doc_326.txt,6-Mar-87,Proclamation 5617—Amending the Generalized System of Preferences,Ronald Reagan,https://www.presidency.ucsb.edu/documents/proclamation-5617-amending-the-generalized-system-preferences,UCSB Presidency Project
doc_327.txt,7-Mar-87,Radio Address to the Nation on Regional Conflicts,Ronald Reagan,https://www.presidency.ucsb.edu/documents/radio-address-the-nation-regional-conflicts,UCSB Presidency Project
doc_328.txt,10-Mar-87,Statement of Administration Policy: H.J. Res. 175 - Moratorium on Contra Aid,Ronald Reagan,https://www.presidency.ucsb.edu/documents/statement-administration-policy-hj-res-175-moratorium-contra-aid,UCSB Presidency Project
doc_329.txt,13-Mar-87,Statement of Administration Policy: S.J. Res. 81 - Disapproving the Provision of Additional Assistance to the Nicaraguan Democratic Resistance,Ronald Reagan,https://www.presidency.ucsb.edu/documents/statement-administration-policy-sj-res-81-disapproving-the-provision-additional-assistance,UCSB Presidency Project
doc_330.txt,19-Mar-87,The President's News Conference,Ronald Reagan,https://www.presidency.ucsb.edu/documents/the-presidents-news-conference-967,UCSB Presidency Project
doc_331.txt,30-Mar-87,Remarks at the 1987 Reagan Administration Executive Forum,Ronald Reagan,https://www.presidency.ucsb.edu/documents/remarks-the-1987-reagan-administration-executive-forum,UCSB Presidency Project
doc_332.txt,6-Apr-87,"Address to a Joint Session of Parliament in Ottawa, Canada",Ronald Reagan,https://www.presidency.ucsb.edu/documents/address-joint-session-parliament-ottawa-canada,UCSB Presidency Project
doc_333.txt,8-Apr-87,Statement by Assistant to the President for Press Relations Fitzwater on the Iran Arms and Contra Aid Controversy Investigations,Ronald Reagan,https://www.presidency.ucsb.edu/documents/statement-assistant-the-president-for-press-relations-fitzwater-the-iran-arms-and-contra-0,UCSB Presidency Project
doc_334.txt,10-Apr-87,Remarks and a Question-and-Answer Session at a Los Angeles World Affairs Council Luncheon in California,Ronald Reagan,https://www.presidency.ucsb.edu/documents/remarks-and-question-and-answer-session-los-angeles-world-affairs-council-luncheon,UCSB Presidency Project
doc_335.txt,18-Apr-87,Radio Address to the Nation on Soviet-United States Relations,Ronald Reagan,https://www.presidency.ucsb.edu/documents/radio-address-the-nation-soviet-united-states-relations-3,UCSB Presidency Project
doc_336.txt,21-Apr-87,Notice of the Continuation of the National Emergency With Respect to Nicaragua,Ronald Reagan,https://www.presidency.ucsb.edu/documents/notice-the-continuation-the-national-emergency-with-respect-nicaragua-2,UCSB Presidency Project
doc_337.txt,21-Apr-87,Message to the Congress on the Continuation of the National Emergency With Respect to Nicaragua,Ronald Reagan,https://www.presidency.ucsb.edu/documents/message-the-congress-the-continuation-the-national-emergency-with-respect-nicaragua-1,UCSB Presidency Project
doc_338.txt,29-Apr-87,Remarks at the Annual Republican Congressional Fund-raising Dinner,Ronald Reagan,https://www.presidency.ucsb.edu/documents/remarks-the-annual-republican-congressional-fund-raising-dinner,UCSB Presidency Project
doc_339.txt,1-May-87,Message to the Congress Reporting on the National Emergency With Respect to Nicaragua,Ronald Reagan,https://www.presidency.ucsb.edu/documents/message-the-congress-reporting-the-national-emergency-with-respect-nicaragua-0,UCSB Presidency Project
doc_340.txt,3-May-87,"Remarks to the 100th Annual Convention of the American Newspaper Publishers Association in New York, New York",Ronald Reagan,https://www.presidency.ucsb.edu/documents/remarks-the-100th-annual-convention-the-american-newspaper-publishers-association-new-york,UCSB Presidency Project
doc_341.txt,12-May-87,Remarks at a White House Briefing for Members of the Council of the Americas,Ronald Reagan,https://www.presidency.ucsb.edu/documents/remarks-white-house-briefing-for-members-the-council-the-americas,UCSB Presidency Project
doc_342.txt,13-May-87,Remarks Following Meetings With President Vinicio Cerezo Arevalo of Guatemala,Ronald Reagan,https://www.presidency.ucsb.edu/documents/remarks-following-meetings-with-president-vinicio-cerezo-arevalo-guatemala,UCSB Presidency Project
doc_343.txt,15-May-87,Remarks and a Question-and-Answer Session With Southeast Regional Editors and Broadcasters,Ronald Reagan,https://www.presidency.ucsb.edu/documents/remarks-and-question-and-answer-session-with-southeast-regional-editors-and-broadcasters,UCSB Presidency Project
doc_344.txt,27-May-87,Interview With Foreign Television Journalists Prior to the Venice Economic Summit,Ronald Reagan,https://www.presidency.ucsb.edu/documents/interview-with-foreign-television-journalists-prior-the-venice-economic-summit,UCSB Presidency Project
doc_345.txt,11-Jun-87,The President's News Conference,Ronald Reagan,https://www.presidency.ucsb.edu/documents/the-presidents-news-conference-966,UCSB Presidency Project
doc_346.txt,17-Jun-87,Statement by Assistant to the President for Press Relations Fitzwater on the Meeting Between President Reagan and President Oscar Arias Sanchez of Costa Rica,Ronald Reagan,https://www.presidency.ucsb.edu/documents/statement-assistant-the-president-for-press-relations-fitzwater-the-meeting-between,UCSB Presidency Project
doc_347.txt,17-Jun-87,Remarks at a Fundraising Reception for Senator Orrin G. Hatch of Utah,Ronald Reagan,https://www.presidency.ucsb.edu/documents/remarks-fundraising-reception-for-senator-orrin-g-hatch-utah,UCSB Presidency Project
doc_348.txt,29-Jun-87,Remarks at a White House Briefing for Administration Supporters,Ronald Reagan,https://www.presidency.ucsb.edu/documents/remarks-white-house-briefing-for-administration-supporters,UCSB Presidency Project
doc_349.txt,17-Jul-87,"Proclamation 5680—Captive Nations Week, 1987",Ronald Reagan,https://www.presidency.ucsb.edu/documents/proclamation-5680-captive-nations-week-1987,UCSB Presidency Project
doc_350.txt,18-Jul-87,Radio Address to the Nation on United States Assistance for the Nicaraguan Democratic Resistance,Ronald Reagan,https://www.presidency.ucsb.edu/documents/radio-address-the-nation-united-states-assistance-for-the-nicaraguan-democratic-2,UCSB Presidency Project
doc_351.txt,24-Jul-87,Remarks to Captive Nations Conference Participants,Ronald Reagan,https://www.presidency.ucsb.edu/documents/remarks-captive-nations-conference-participants,UCSB Presidency Project
doc_352.txt,3-Aug-87,Remarks on Receiving the Report of the Presidential Task Force on Project Economic Justice,Ronald Reagan,https://www.presidency.ucsb.edu/documents/remarks-receiving-the-report-the-presidential-task-force-project-economic-justice,UCSB Presidency Project
doc_353.txt,5-Aug-87,Remarks to Reporters Announcing the Central American Peace Initiative,Ronald Reagan,https://www.presidency.ucsb.edu/documents/remarks-reporters-announcing-the-central-american-peace-initiative,UCSB Presidency Project
doc_354.txt,8-Aug-87,Radio Address to the Nation on the 26th Anniversary of the Berlin Wall,Ronald Reagan,https://www.presidency.ucsb.edu/documents/radio-address-the-nation-the-26th-anniversary-the-berlin-wall,UCSB Presidency Project
doc_355.txt,8-Aug-87,Statement on the Central American Peace Agreement,Ronald Reagan,https://www.presidency.ucsb.edu/documents/statement-the-central-american-peace-agreement,UCSB Presidency Project
doc_356.txt,12-Aug-87,Address to the Nation on the Iran Arms and Contra Aid Controversy and Administration Goals,Ronald Reagan,https://www.presidency.ucsb.edu/documents/address-the-nation-the-iran-arms-and-contra-aid-controversy-and-administration-goals,UCSB Presidency Project
doc_357.txt,13-Aug-87,"Remarks to Citizens in North Platte, Nebraska",Ronald Reagan,https://www.presidency.ucsb.edu/documents/remarks-citizens-north-platte-nebraska,UCSB Presidency Project
doc_358.txt,15-Aug-87,Radio Address to the Nation on Administration Goals,Ronald Reagan,https://www.presidency.ucsb.edu/documents/radio-address-the-nation-administration-goals-2,UCSB Presidency Project
doc_359.txt,22-Aug-87,Address to the People of Nicaragua on the Central American Peace Plan,Ronald Reagan,https://www.presidency.ucsb.edu/documents/address-the-people-nicaragua-the-central-american-peace-plan,UCSB Presidency Project
doc_360.txt,26-Aug-87,Remarks on Soviet-United States Relations at the Town Hall of California Meeting in Los Angeles,Ronald Reagan,https://www.presidency.ucsb.edu/documents/remarks-soviet-united-states-relations-the-town-hall-california-meeting-los-angeles,UCSB Presidency Project
doc_361.txt,27-Aug-87,"Remarks at a Meeting With Nicaraguan Democratic Resistance Leaders in Los Angeles, California",Ronald Reagan,https://www.presidency.ucsb.edu/documents/remarks-meeting-with-nicaraguan-democratic-resistance-leaders-los-angeles-california,UCSB Presidency Project
doc_362.txt,29-Aug-87,Radio Address to the Nation on Soviet-United States Relations,Ronald Reagan,https://www.presidency.ucsb.edu/documents/radio-address-the-nation-soviet-united-states-relations-2,UCSB Presidency Project
doc_363.txt,12-Sep-87,Radio Address to the Nation on the Situation in Nicaragua,Ronald Reagan,https://www.presidency.ucsb.edu/documents/radio-address-the-nation-the-situation-nicaragua-0,UCSB Presidency Project
doc_364.txt,19-Sep-87,"Radio Address to the Nation on Robert H. Bork, Arms Control, and the Budget",Ronald Reagan,https://www.presidency.ucsb.edu/documents/radio-address-the-nation-robert-h-bork-arms-control-and-the-budget,UCSB Presidency Project
doc_365.txt,21-Sep-87,"Address to the 42d Session of the United Nations General Assembly in New York, New York",Ronald Reagan,https://www.presidency.ucsb.edu/documents/address-the-42d-session-the-united-nations-general-assembly-new-york-new-york,UCSB Presidency Project
doc_366.txt,22-Sep-87,Written Responses to Questions Submitted by the Swedish Newspaper Svenska Dagbladet,Ronald Reagan,https://www.presidency.ucsb.edu/documents/written-responses-questions-submitted-the-swedish-newspaper-svenska-dagbladet,UCSB Presidency Project
doc_367.txt,25-Sep-87,Remarks at the Annual Convention of Concerned Women for America,Ronald Reagan,https://www.presidency.ucsb.edu/documents/remarks-the-annual-convention-concerned-women-for-america,UCSB Presidency Project
doc_368.txt,28-Sep-87,Written Responses to Questions Submitted by the Swedish Newspaper Tidningarnas Telegrambyra,Ronald Reagan,https://www.presidency.ucsb.edu/documents/written-responses-questions-submitted-the-swedish-newspaper-tidningarnas-telegrambyra,UCSB Presidency Project
doc_369.txt,7-Oct-87,Address to the Permanent Council of the Organization of American States,Ronald Reagan,https://www.presidency.ucsb.edu/documents/address-the-permanent-council-the-organization-american-states,UCSB Presidency Project
doc_370.txt,14-Oct-87,Remarks at the Welcoming Ceremony for President Jose Napoleon Duarte Fuentes of El Salvador,Ronald Reagan,https://www.presidency.ucsb.edu/documents/remarks-the-welcoming-ceremony-for-president-jose-napoleon-duarte-fuentes-el-salvador,UCSB Presidency Project
doc_371.txt,21-Oct-87,Remarks at a White House Briefing for the Citizens Network for Foreign Affairs,Ronald Reagan,https://www.presidency.ucsb.edu/documents/remarks-white-house-briefing-for-the-citizens-network-for-foreign-affairs,UCSB Presidency Project
doc_372.txt,28-Oct-87,"Remarks at the United States Military Academy in West Point, New York",Ronald Reagan,https://www.presidency.ucsb.edu/documents/remarks-the-united-states-military-academy-west-point-new-york-0,UCSB Presidency Project
doc_373.txt,30-Oct-87,Message to the Congress Reporting on the National Emergency With Respect to Nicaragua,Ronald Reagan,https://www.presidency.ucsb.edu/documents/message-the-congress-reporting-the-national-emergency-with-respect-nicaragua-1,UCSB Presidency Project
doc_374.txt,6-Nov-87,Nomination of Richard Huntington Melton To Be United States Ambassador to Nicaragua,Ronald Reagan,https://www.presidency.ucsb.edu/documents/nomination-richard-huntington-melton-be-united-states-ambassador-nicaragua,UCSB Presidency Project
doc_375.txt,7-Nov-87,Radio Address to the Nation on Philippine-United States Relations and the Situation in Central America,Ronald Reagan,https://www.presidency.ucsb.edu/documents/radio-address-the-nation-philippine-united-states-relations-and-the-situation-central,UCSB Presidency Project
doc_376.txt,9-Nov-87,Remarks to Representatives of the Organization of American States,Ronald Reagan,https://www.presidency.ucsb.edu/documents/remarks-representatives-the-organization-american-states,UCSB Presidency Project
doc_377.txt,14-Nov-87,"Radio Address to the Nation on the Supreme Court Nomination of Anthony M. Kennedy, Central America, and Deficit Reduction",Ronald Reagan,https://www.presidency.ucsb.edu/documents/radio-address-the-nation-the-supreme-court-nomination-anthony-m-kennedy-central-america,UCSB Presidency Project
doc_378.txt,16-Nov-87,Statement by Assistant to the President for Press Relations Fitzwater on Discussions Between the Speaker of the House of Representatives and President Daniel Ortega of Nicaragua,Ronald Reagan,https://www.presidency.ucsb.edu/documents/statement-assistant-the-president-for-press-relations-fitzwater-discussions-between-the,UCSB Presidency Project
doc_379.txt,16-Nov-87,Remarks at the Annual Meeting of the American Council of Life Insurance,Ronald Reagan,https://www.presidency.ucsb.edu/documents/remarks-the-annual-meeting-the-american-council-life-insurance,UCSB Presidency Project
doc_380.txt,23-Nov-87,"Remarks to Administration Supporters at a White House Briefing on Arms Control, Central America, and the Supreme Court",Ronald Reagan,https://www.presidency.ucsb.edu/documents/remarks-administration-supporters-white-house-briefing-arms-control-central-america-and,UCSB Presidency Project
doc_381.txt,28-Nov-87,Radio Address to the Nation on Soviet-United States Relations,Ronald Reagan,https://www.presidency.ucsb.edu/documents/radio-address-the-nation-soviet-united-states-relations-4,UCSB Presidency Project
doc_382.txt,30-Nov-87,Remarks at a Luncheon Hosted by the Heritage Foundation,Ronald Reagan,https://www.presidency.ucsb.edu/documents/remarks-luncheon-hosted-the-heritage-foundation,UCSB Presidency Project
doc_383.txt,1-Dec-87,"Remarks and a Question-and-Answer Session With Area High School Seniors in Jacksonville, Florida",Ronald Reagan,https://www.presidency.ucsb.edu/documents/remarks-and-question-and-answer-session-with-area-high-school-seniors-jacksonville-florida,UCSB Presidency Project
doc_384.txt,3-Dec-87,Interview With Television Network Broadcasters,Ronald Reagan,https://www.presidency.ucsb.edu/documents/interview-with-television-network-broadcasters,UCSB Presidency Project
doc_385.txt,3-Dec-87,Written Responses to Questions Submitted by the Soviet Newspaper Izvestiya,Ronald Reagan,https://www.presidency.ucsb.edu/documents/written-responses-questions-submitted-the-soviet-newspaper-izvestiya,UCSB Presidency Project
doc_386.txt,5-Dec-87,Radio Address to the Nation on Deficit Reduction and Soviet-United States Relations,Ronald Reagan,https://www.presidency.ucsb.edu/documents/radio-address-the-nation-deficit-reduction-and-soviet-united-states-relations,UCSB Presidency Project
doc_387.txt,9-Dec-87,Excerpts From an Interview With Conservative Columnists Following the Soviet-United States Summit Meeting,Ronald Reagan,https://www.presidency.ucsb.edu/documents/excerpts-from-interview-with-conservative-columnists-following-the-soviet-united-states,UCSB Presidency Project
doc_388.txt,10-Dec-87,Address to the Nation on the Soviet-United States Summit Meeting,Ronald Reagan,https://www.presidency.ucsb.edu/documents/address-the-nation-the-soviet-united-states-summit-meeting,UCSB Presidency Project
doc_389.txt,11-Dec-87,Remarks and a Question-and-Answer Session With News Editors and Broadcasters,Ronald Reagan,https://www.presidency.ucsb.edu/documents/remarks-and-question-and-answer-session-with-news-editors-and-broadcasters,UCSB Presidency Project
doc_390.txt,12-Dec-87,Radio Address to the Nation Following the Soviet-United States Summit Meeting,Ronald Reagan,https://www.presidency.ucsb.edu/documents/radio-address-the-nation-following-the-soviet-united-states-summit-meeting,UCSB Presidency Project
doc_391.txt,19-Dec-87,Radio Address to the Nation on Foreign Issues and the Budget,Ronald Reagan,https://www.presidency.ucsb.edu/documents/radio-address-the-nation-foreign-issues-and-the-budget,UCSB Presidency Project
doc_392.txt,22-Dec-87,Remarks on Signing the Continuing Appropriations for Fiscal Year 1988 and the Omnibus Budget Reconciliation Act of 1987,Ronald Reagan,https://www.presidency.ucsb.edu/documents/remarks-signing-the-continuing-appropriations-for-fiscal-year-1988-and-the-omnibus-budget,UCSB Presidency Project
doc_393.txt,11-Jan-88,"Remarks and a Question-and-Answer Session With Members of the City Club of Cleveland, Ohio",Ronald Reagan,https://www.presidency.ucsb.edu/documents/remarks-and-question-and-answer-session-with-members-the-city-club-cleveland-ohio,UCSB Presidency Project
doc_394.txt,19-Jan-88,Statement by Assistant to the President for Press Relations Fitzwater on the Central American Peace Process,Ronald Reagan,https://www.presidency.ucsb.edu/documents/statement-assistant-the-president-for-press-relations-fitzwater-the-central-american-peace,UCSB Presidency Project
doc_395.txt,19-Jan-88,White House Statement on the Presidential Determination on Assistance to the Nicaraguan Democratic Resistance,Ronald Reagan,https://www.presidency.ucsb.edu/documents/white-house-statement-the-presidential-determination-assistance-the-nicaraguan-democratic,UCSB Presidency Project
doc_396.txt,19-Jan-88,Memorandum on Assistance to the Nicaraguan Democratic Resistance,Ronald Reagan,https://www.presidency.ucsb.edu/documents/memorandum-assistance-the-nicaraguan-democratic-resistance,UCSB Presidency Project
doc_397.txt,19-Jan-88,Remarks at the 1988 Reagan Administration Executive Forum,Ronald Reagan,https://www.presidency.ucsb.edu/documents/remarks-the-1988-reagan-administration-executive-forum,UCSB Presidency Project
doc_398.txt,19-Jan-88,Letter to the Speaker of the House of Representatives and the President of the Senate Transmitting a Presidential Determination on Assistance to the Nicaraguan Democratic Resistance,Ronald Reagan,https://www.presidency.ucsb.edu/documents/letter-the-speaker-the-house-representatives-and-the-president-the-senate-transmitting-14,UCSB Presidency Project
doc_399.txt,20-Jan-88,Remarks to Civic Leaders at a White House Briefing on Aid to the Nicaraguan Democratic Resistance,Ronald Reagan,https://www.presidency.ucsb.edu/documents/remarks-civic-leaders-white-house-briefing-aid-the-nicaraguan-democratic-resistance-0,UCSB Presidency Project
doc_400.txt,22-Jan-88,Remarks to Civic Leaders at a White House Briefing on Aid to the Nicaraguan Democratic Resistance,Ronald Reagan,https://www.presidency.ucsb.edu/documents/remarks-civic-leaders-white-house-briefing-aid-the-nicaraguan-democratic-resistance,UCSB Presidency Project
doc_401.txt,23-Jan-88,Radio Address to the Nation on Administration Goals,Ronald Reagan,https://www.presidency.ucsb.edu/documents/radio-address-the-nation-administration-goals,UCSB Presidency Project
doc_402.txt,25-Jan-88,1988 Legislative and Administrative Message: A Union of Individuals,Ronald Reagan,https://www.presidency.ucsb.edu/documents/1988-legislative-and-administrative-message-union-individuals,UCSB Presidency Project
doc_403.txt,25-Jan-88,Address Before a Joint Session of Congress on the State of the Union,Ronald Reagan,https://www.presidency.ucsb.edu/documents/address-before-joint-session-congress-the-state-the-union-0,UCSB Presidency Project
doc_404.txt,27-Jan-88,White House Statement on Aid to the Nicaraguan Democratic Resistance,Ronald Reagan,https://www.presidency.ucsb.edu/documents/white-house-statement-aid-the-nicaraguan-democratic-resistance,UCSB Presidency Project
doc_405.txt,27-Jan-88,Remarks to Members of the Reserve Officers Association,Ronald Reagan,https://www.presidency.ucsb.edu/documents/remarks-members-the-reserve-officers-association,UCSB Presidency Project
doc_406.txt,27-Jan-88,Message to the Congress Transmitting a Request for Aid for the Nicaraguan Democratic Resistance,Ronald Reagan,https://www.presidency.ucsb.edu/documents/message-the-congress-transmitting-request-for-aid-for-the-nicaraguan-democratic-resistance,UCSB Presidency Project
doc_407.txt,29-Jan-88,Remarks to the National Conference of State Legislators,Ronald Reagan,https://www.presidency.ucsb.edu/documents/remarks-the-national-conference-state-legislators,UCSB Presidency Project
doc_408.txt,30-Jan-88,Statement on the 44th Session of the United Nations Commission on Human Rights,Ronald Reagan,https://www.presidency.ucsb.edu/documents/statement-the-44th-session-the-united-nations-commission-human-rights,UCSB Presidency Project
doc_409.txt,30-Jan-88,Radio Address to the Nation on Aid to the Nicaraguan Democratic Resistance,Ronald Reagan,https://www.presidency.ucsb.edu/documents/radio-address-the-nation-aid-the-nicaraguan-democratic-resistance-0,UCSB Presidency Project
doc_410.txt,1-Feb-88,Remarks at the Annual Convention of the National Religious Broadcasters Association,Ronald Reagan,https://www.presidency.ucsb.edu/documents/remarks-the-annual-convention-the-national-religious-broadcasters-association,UCSB Presidency Project
doc_411.txt,2-Feb-88,Address to the Nation on Aid to the Nicaraguan Democratic Resistance,Ronald Reagan,https://www.presidency.ucsb.edu/documents/address-the-nation-aid-the-nicaraguan-democratic-resistance,UCSB Presidency Project
