date,title,url,president
"Aug 12, 1987",Address to the Nation on the Iran Arms and Contra Aid Controversy and Administration Goals,https://www.presidency.ucsb.edu/documents/address-the-nation-the-iran-arms-and-contra-aid-controversy-and-administration-goals,Ronald Reagan
"Aug 13, 1987","Remarks to Citizens in North Platte, Nebraska",https://www.presidency.ucsb.edu/documents/remarks-citizens-north-platte-nebraska,Ronald Reagan
"Aug 15, 1987",Radio Address to the Nation on Administration Goals,https://www.presidency.ucsb.edu/documents/radio-address-the-nation-administration-goals-2,Ronald Reagan
"Aug 22, 1987",Address to the People of Nicaragua on the Central American Peace Plan,https://www.presidency.ucsb.edu/documents/address-the-people-nicaragua-the-central-american-peace-plan,Ronald Reagan
"Aug 26, 1987",Remarks on Soviet-United States Relations at the Town Hall of California Meeting in Los Angeles,https://www.presidency.ucsb.edu/documents/remarks-soviet-united-states-relations-the-town-hall-california-meeting-los-angeles,Ronald Reagan
"Aug 27, 1987","Remarks at a Meeting With Nicaraguan Democratic Resistance Leaders in Los Angeles, California",https://www.presidency.ucsb.edu/documents/remarks-meeting-with-nicaraguan-democratic-resistance-leaders-los-angeles-california,Ronald Reagan
"Aug 29, 1987",Radio Address to the Nation on Soviet-United States Relations,https://www.presidency.ucsb.edu/documents/radio-address-the-nation-soviet-united-states-relations-2,Ronald Reagan
"Sep 12, 1987",Radio Address to the Nation on the Situation in Nicaragua,https://www.presidency.ucsb.edu/documents/radio-address-the-nation-the-situation-nicaragua-0,Ronald Reagan
"Sep 19, 1987","Radio Address to the Nation on Robert H. Bork, Arms Control, and the Budget",https://www.presidency.ucsb.edu/documents/radio-address-the-nation-robert-h-bork-arms-control-and-the-budget,Ronald Reagan
"Sep 21, 1987","Address to the 42d Session of the United Nations General Assembly in New York, New York",https://www.presidency.ucsb.edu/documents/address-the-42d-session-the-united-nations-general-assembly-new-york-new-york,Ronald Reagan
"Sep 22, 1987",Written Responses to Questions Submitted by the Swedish Newspaper Svenska Dagbladet,https://www.presidency.ucsb.edu/documents/written-responses-questions-submitted-the-swedish-newspaper-svenska-dagbladet,Ronald Reagan
"Sep 25, 1987",Remarks at the Annual Convention of Concerned Women for America,https://www.presidency.ucsb.edu/documents/remarks-the-annual-convention-concerned-women-for-america,Ronald Reagan
"Sep 28, 1987",Written Responses to Questions Submitted by the Swedish Newspaper Tidningarnas Telegrambyra,https://www.presidency.ucsb.edu/documents/written-responses-questions-submitted-the-swedish-newspaper-tidningarnas-telegrambyra,Ronald Reagan
"Oct 07, 1987",Address to the Permanent Council of the Organization of American States,https://www.presidency.ucsb.edu/documents/address-the-permanent-council-the-organization-american-states,Ronald Reagan
"Oct 14, 1987",Remarks at the Welcoming Ceremony for President Jose Napoleon Duarte Fuentes of El Salvador,https://www.presidency.ucsb.edu/documents/remarks-the-welcoming-ceremony-for-president-jose-napoleon-duarte-fuentes-el-salvador,Ronald Reagan
"Oct 21, 1987",Remarks at a White House Briefing for the Citizens Network for Foreign Affairs,https://www.presidency.ucsb.edu/documents/remarks-white-house-briefing-for-the-citizens-network-for-foreign-affairs,Ronald Reagan
"Oct 28, 1987","Remarks at the United States Military Academy in West Point, New York",https://www.presidency.ucsb.edu/documents/remarks-the-united-states-military-academy-west-point-new-york-0,Ronald Reagan
"Oct 30, 1987",Message to the Congress Reporting on the National Emergency With Respect to Nicaragua,https://www.presidency.ucsb.edu/documents/message-the-congress-reporting-the-national-emergency-with-respect-nicaragua-1,Ronald Reagan
"Nov 06, 1987",Nomination of Richard Huntington Melton To Be United States Ambassador to Nicaragua,https://www.presidency.ucsb.edu/documents/nomination-richard-huntington-melton-be-united-states-ambassador-nicaragua,Ronald Reagan
"Nov 07, 1987",Radio Address to the Nation on Philippine-United States Relations and the Situation in Central America,https://www.presidency.ucsb.edu/documents/radio-address-the-nation-philippine-united-states-relations-and-the-situation-central,Ronald Reagan
"Nov 09, 1987",Remarks to Representatives of the Organization of American States,https://www.presidency.ucsb.edu/documents/remarks-representatives-the-organization-american-states,Ronald Reagan
"Nov 14, 1987","Radio Address to the Nation on the Supreme Court Nomination of Anthony M. Kennedy, Central America, and Deficit Reduction",https://www.presidency.ucsb.edu/documents/radio-address-the-nation-the-supreme-court-nomination-anthony-m-kennedy-central-america,Ronald Reagan
"Nov 16, 1987",Statement by Assistant to the President for Press Relations Fitzwater on Discussions Between the Speaker of the House of Representatives and President Daniel Ortega of Nicaragua,https://www.presidency.ucsb.edu/documents/statement-assistant-the-president-for-press-relations-fitzwater-discussions-between-the,Ronald Reagan
"Nov 16, 1987",Remarks at the Annual Meeting of the American Council of Life Insurance,https://www.presidency.ucsb.edu/documents/remarks-the-annual-meeting-the-american-council-life-insurance,Ronald Reagan
"Nov 23, 1987","Remarks to Administration Supporters at a White House Briefing on Arms Control, Central America, and the Supreme Court",https://www.presidency.ucsb.edu/documents/remarks-administration-supporters-white-house-briefing-arms-control-central-america-and,Ronald Reagan
"Nov 28, 1987",Radio Address to the Nation on Soviet-United States Relations,https://www.presidency.ucsb.edu/documents/radio-address-the-nation-soviet-united-states-relations-4,Ronald Reagan
"Nov 30, 1987",Remarks at a Luncheon Hosted by the Heritage Foundation,https://www.presidency.ucsb.edu/documents/remarks-luncheon-hosted-the-heritage-foundation,Ronald Reagan
"Dec 01, 1987","Remarks and a Question-and-Answer Session With Area High School Seniors in Jacksonville, Florida",https://www.presidency.ucsb.edu/documents/remarks-and-question-and-answer-session-with-area-high-school-seniors-jacksonville-florida,Ronald Reagan
"Dec 03, 1987",Interview With Television Network Broadcasters,https://www.presidency.ucsb.edu/documents/interview-with-television-network-broadcasters,Ronald Reagan
"Dec 03, 1987",Written Responses to Questions Submitted by the Soviet Newspaper Izvestiya,https://www.presidency.ucsb.edu/documents/written-responses-questions-submitted-the-soviet-newspaper-izvestiya,Ronald Reagan
"Dec 05, 1987",Radio Address to the Nation on Deficit Reduction and Soviet-United States Relations,https://www.presidency.ucsb.edu/documents/radio-address-the-nation-deficit-reduction-and-soviet-united-states-relations,Ronald Reagan
"Dec 09, 1987",Excerpts From an Interview With Conservative Columnists Following the Soviet-United States Summit Meeting,https://www.presidency.ucsb.edu/documents/excerpts-from-interview-with-conservative-columnists-following-the-soviet-united-states,Ronald Reagan
"Dec 10, 1987",Address to the Nation on the Soviet-United States Summit Meeting,https://www.presidency.ucsb.edu/documents/address-the-nation-the-soviet-united-states-summit-meeting,Ronald Reagan
"Dec 11, 1987",Remarks and a Question-and-Answer Session With News Editors and Broadcasters,https://www.presidency.ucsb.edu/documents/remarks-and-question-and-answer-session-with-news-editors-and-broadcasters,Ronald Reagan
"Dec 12, 1987",Radio Address to the Nation Following the Soviet-United States Summit Meeting,https://www.presidency.ucsb.edu/documents/radio-address-the-nation-following-the-soviet-united-states-summit-meeting,Ronald Reagan
"Dec 19, 1987",Radio Address to the Nation on Foreign Issues and the Budget,https://www.presidency.ucsb.edu/documents/radio-address-the-nation-foreign-issues-and-the-budget,Ronald Reagan
"Dec 22, 1987",Remarks on Signing the Continuing Appropriations for Fiscal Year 1988 and the Omnibus Budget Reconciliation Act of 1987,https://www.presidency.ucsb.edu/documents/remarks-signing-the-continuing-appropriations-for-fiscal-year-1988-and-the-omnibus-budget,Ronald Reagan
"Jan 11, 1988","Remarks and a Question-and-Answer Session With Members of the City Club of Cleveland, Ohio",https://www.presidency.ucsb.edu/documents/remarks-and-question-and-answer-session-with-members-the-city-club-cleveland-ohio,Ronald Reagan
"Jan 19, 1988",Statement by Assistant to the President for Press Relations Fitzwater on the Central American Peace Process,https://www.presidency.ucsb.edu/documents/statement-assistant-the-president-for-press-relations-fitzwater-the-central-american-peace,Ronald Reagan
"Jan 19, 1988",White House Statement on the Presidential Determination on Assistance to the Nicaraguan Democratic Resistance,https://www.presidency.ucsb.edu/documents/white-house-statement-the-presidential-determination-assistance-the-nicaraguan-democratic,Ronald Reagan
"Jan 19, 1988",Memorandum on Assistance to the Nicaraguan Democratic Resistance,https://www.presidency.ucsb.edu/documents/memorandum-assistance-the-nicaraguan-democratic-resistance,Ronald Reagan
"Jan 19, 1988",Remarks at the 1988 Reagan Administration Executive Forum,https://www.presidency.ucsb.edu/documents/remarks-the-1988-reagan-administration-executive-forum,Ronald Reagan
"Jan 19, 1988",Letter to the Speaker of the House of Representatives and the President of the Senate Transmitting a Presidential Determination on Assistance to the Nicaraguan Democratic Resistance,https://www.presidency.ucsb.edu/documents/letter-the-speaker-the-house-representatives-and-the-president-the-senate-transmitting-14,Ronald Reagan
"Jan 20, 1988",Remarks to Civic Leaders at a White House Briefing on Aid to the Nicaraguan Democratic Resistance,https://www.presidency.ucsb.edu/documents/remarks-civic-leaders-white-house-briefing-aid-the-nicaraguan-democratic-resistance-0,Ronald Reagan
"Jan 22, 1988",Remarks to Civic Leaders at a White House Briefing on Aid to the Nicaraguan Democratic Resistance,https://www.presidency.ucsb.edu/documents/remarks-civic-leaders-white-house-briefing-aid-the-nicaraguan-democratic-resistance,Ronald Reagan
"Jan 23, 1988",Radio Address to the Nation on Administration Goals,https://www.presidency.ucsb.edu/documents/radio-address-the-nation-administration-goals,Ronald Reagan
"Jan 25, 1988",1988 Legislative and Administrative Message: A Union of Individuals,https://www.presidency.ucsb.edu/documents/1988-legislative-and-administrative-message-union-individuals,Ronald Reagan
"Jan 25, 1988",Address Before a Joint Session of Congress on the State of the Union,https://www.presidency.ucsb.edu/documents/address-before-joint-session-congress-the-state-the-union-0,Ronald Reagan
"Jan 27, 1988",White House Statement on Aid to the Nicaraguan Democratic Resistance,https://www.presidency.ucsb.edu/documents/white-house-statement-aid-the-nicaraguan-democratic-resistance,Ronald Reagan
"Jan 27, 1988",Remarks to Members of the Reserve Officers Association,https://www.presidency.ucsb.edu/documents/remarks-members-the-reserve-officers-association,Ronald Reagan
"Jan 27, 1988",Message to the Congress Transmitting a Request for Aid for the Nicaraguan Democratic Resistance,https://www.presidency.ucsb.edu/documents/message-the-congress-transmitting-request-for-aid-for-the-nicaraguan-democratic-resistance,Ronald Reagan
"Jan 29, 1988",Remarks to the National Conference of State Legislators,https://www.presidency.ucsb.edu/documents/remarks-the-national-conference-state-legislators,Ronald Reagan
"Jan 30, 1988",Statement on the 44th Session of the United Nations Commission on Human Rights,https://www.presidency.ucsb.edu/documents/statement-the-44th-session-the-united-nations-commission-human-rights,Ronald Reagan
"Jan 30, 1988",Radio Address to the Nation on Aid to the Nicaraguan Democratic Resistance,https://www.presidency.ucsb.edu/documents/radio-address-the-nation-aid-the-nicaraguan-democratic-resistance-0,Ronald Reagan
"Feb 01, 1988",Remarks at the Annual Convention of the National Religious Broadcasters Association,https://www.presidency.ucsb.edu/documents/remarks-the-annual-convention-the-national-religious-broadcasters-association,Ronald Reagan
"Feb 02, 1988",Address to the Nation on Aid to the Nicaraguan Democratic Resistance,https://www.presidency.ucsb.edu/documents/address-the-nation-aid-the-nicaraguan-democratic-resistance,Ronald Reagan
"Feb 03, 1988",Letter to the Congressional Leadership on Aid to the Nicaraguan Democratic Resistance,https://www.presidency.ucsb.edu/documents/letter-the-congressional-leadership-aid-the-nicaraguan-democratic-resistance,Ronald Reagan
"Feb 04, 1988",Statement on the House of Representatives Failure to Approve Aid for the Nicaraguan Democratic Resistance,https://www.presidency.ucsb.edu/documents/statement-the-house-representatives-failure-approve-aid-for-the-nicaraguan-democratic,Ronald Reagan
"Feb 04, 1988",Statement by Assistant to the President for Press Relations Fitzwater on Senate Approval of Aid for the Nicaraguan Democratic Resistance,https://www.presidency.ucsb.edu/documents/statement-assistant-the-president-for-press-relations-fitzwater-senate-approval-aid-for,Ronald Reagan
"Feb 06, 1988",Radio Address to the Nation on Drug Abuse and Aid to the Nicaraguan Democratic Resistance,https://www.presidency.ucsb.edu/documents/radio-address-the-nation-drug-abuse-and-aid-the-nicaraguan-democratic-resistance-0,Ronald Reagan
"Feb 10, 1988",Written Responses to Questions Submitted by the Mexican Newspaper Notimex,https://www.presidency.ucsb.edu/documents/written-responses-questions-submitted-the-mexican-newspaper-notimex,Ronald Reagan
"Feb 11, 1988",Remarks at the Annual Conservative Political Action Conference Dinner,https://www.presidency.ucsb.edu/documents/remarks-the-annual-conservative-political-action-conference-dinner-0,Ronald Reagan
"Feb 13, 1988","Toast at a Luncheon Hosted by President Miguel De la Madrid Hurtado in Mazatlan, Mexico",https://www.presidency.ucsb.edu/documents/toast-luncheon-hosted-president-miguel-de-la-madrid-hurtado-mazatlan-mexico,Ronald Reagan
"Feb 24, 1988",The President's News Conference,https://www.presidency.ucsb.edu/documents/the-presidents-news-conference-964,Ronald Reagan
"Feb 27, 1988",Radio Address to the Nation on Drug Abuse and Aid to the Nicaraguan Democratic Resistance,https://www.presidency.ucsb.edu/documents/radio-address-the-nation-drug-abuse-and-aid-the-nicaraguan-democratic-resistance,Ronald Reagan
"Feb 29, 1988",Remarks at the Annual Leadership Conference of the American Legion,https://www.presidency.ucsb.edu/documents/remarks-the-annual-leadership-conference-the-american-legion,Ronald Reagan
"Mar 03, 1988",Statement on the House of Representatives Disapproval of Aid to the Nicaraguan Democratic Resistance,https://www.presidency.ucsb.edu/documents/statement-the-house-representatives-disapproval-aid-the-nicaraguan-democratic-resistance,Ronald Reagan
"Mar 03, 1988","Remarks to Reporters Following the North Atlantic Treaty Organization Summit Meeting in Brussels, Belgium",https://www.presidency.ucsb.edu/documents/remarks-reporters-following-the-north-atlantic-treaty-organization-summit-meeting-brussels,Ronald Reagan
"Mar 03, 1988",Letter to Congressional Leaders on Aid to the Nicaraguan Democratic Resistance,https://www.presidency.ucsb.edu/documents/letter-congressional-leaders-aid-the-nicaraguan-democratic-resistance,Ronald Reagan
"Mar 04, 1988",Statement on the House of Representatives Disapproval of Aid to the Nicaraguan Democratic Resistance,https://www.presidency.ucsb.edu/documents/statement-the-house-representatives-disapproval-aid-the-nicaraguan-democratic-resistance-0,Ronald Reagan
"Mar 07, 1988",Remarks at the Annual Conference of the Veterans of Foreign Wars,https://www.presidency.ucsb.edu/documents/remarks-the-annual-conference-the-veterans-foreign-wars-0,Ronald Reagan
"Mar 10, 1988",Interview With Alastair Burnet of ITN Television of the United Kingdom,https://www.presidency.ucsb.edu/documents/interview-with-alastair-burnet-itn-television-the-united-kingdom,Ronald Reagan
"Mar 10, 1988",Interview With Dieter Kronzucker of ZDF Television of the Federal Republic of Germany,https://www.presidency.ucsb.edu/documents/interview-with-dieter-kronzucker-zdf-television-the-federal-republic-germany,Ronald Reagan
"Mar 15, 1988",Remarks to Supporters of Israel at a White House Briefing on United States Foreign Policy,https://www.presidency.ucsb.edu/documents/remarks-supporters-israel-white-house-briefing-united-states-foreign-policy,Ronald Reagan
"Mar 16, 1988",Statement by Assistant to the President for Press Relations Fitzwater on the Deployment of United States Armed Forces to Honduras,https://www.presidency.ucsb.edu/documents/statement-assistant-the-president-for-press-relations-fitzwater-the-deployment-united,Ronald Reagan
"Mar 18, 1988",Announcement of the United States Delegation of Observers for Elections in El Salvador,https://www.presidency.ucsb.edu/documents/announcement-the-united-states-delegation-observers-for-elections-el-salvador,Ronald Reagan
"Mar 19, 1988",Radio Address to the Nation on the Deployment of United States Forces to Honduras and the Strategic Defense Initiative,https://www.presidency.ucsb.edu/documents/radio-address-the-nation-the-deployment-united-states-forces-honduras-and-the-strategic,Ronald Reagan
"Mar 22, 1988",Remarks to the House of Representatives Republican Conference,https://www.presidency.ucsb.edu/documents/remarks-the-house-representatives-republican-conference,Ronald Reagan
"Mar 22, 1988",Remarks to State and Local Republican Officials on Federalism and Aid to the Nicaraguan Democratic Resistance,https://www.presidency.ucsb.edu/documents/remarks-state-and-local-republican-officials-federalism-and-aid-the-nicaraguan-democratic,Ronald Reagan
"Mar 22, 1988",Remarks at a Fund-raising Reception for Senator Chic Hecht of Nevada,https://www.presidency.ucsb.edu/documents/remarks-fund-raising-reception-for-senator-chic-hecht-nevada,Ronald Reagan
"Apr 10, 1988","Remarks at the Annual Convention of the National Association of Broadcasters in Las Vegas, Nevada",https://www.presidency.ucsb.edu/documents/remarks-the-annual-convention-the-national-association-broadcasters-las-vegas-nevada,Ronald Reagan
"Apr 13, 1988",Remarks at the Annual Convention of the American Society of Newspaper Editors,https://www.presidency.ucsb.edu/documents/remarks-the-annual-convention-the-american-society-newspaper-editors,Ronald Reagan
"Apr 19, 1988",Remarks at a Senate Campaign Fund-raising Reception for Pete Dawkins of New Jersey,https://www.presidency.ucsb.edu/documents/remarks-senate-campaign-fund-raising-reception-for-pete-dawkins-new-jersey,Ronald Reagan
"Apr 21, 1988",Remarks to the World Affairs Council of Western Massachusetts in Springfield,https://www.presidency.ucsb.edu/documents/remarks-the-world-affairs-council-western-massachusetts-springfield,Ronald Reagan
"Apr 25, 1988",Notice of the Continuation of the National Emergency With Respect to Nicaragua,https://www.presidency.ucsb.edu/documents/notice-the-continuation-the-national-emergency-with-respect-nicaragua-1,Ronald Reagan
"Apr 25, 1988",Message to the Congress on the Continuation of the National Emergency With Respect to Nicaragua,https://www.presidency.ucsb.edu/documents/message-the-congress-the-continuation-the-national-emergency-with-respect-nicaragua-0,Ronald Reagan
"Apr 29, 1988",Letter to the Speaker of the House of Representatives and the President of the Senate Reporting on the National Emergency With Respect to Nicaragua,https://www.presidency.ucsb.edu/documents/letter-the-speaker-the-house-representatives-and-the-president-the-senate-reporting-the-6,Ronald Reagan
"May 11, 1988",Remarks at the Annual Republican Congressional Fundraising Dinner,https://www.presidency.ucsb.edu/documents/remarks-the-annual-republican-congressional-fundraising-dinner-3,Ronald Reagan
"May 20, 1988",Remarks at a Cuban Independence Day Ceremony,https://www.presidency.ucsb.edu/documents/remarks-cuban-independence-day-ceremony,Ronald Reagan
"May 20, 1988",Interview With Soviet Television Journalists Valentin Zorin and Boris Kalyagin,https://www.presidency.ucsb.edu/documents/interview-with-soviet-television-journalists-valentin-zorin-and-boris-kalyagin,Ronald Reagan
"May 24, 1988",Statement on Aid to the Nicaraguan Democratic Resistance,https://www.presidency.ucsb.edu/documents/statement-aid-the-nicaraguan-democratic-resistance,Ronald Reagan
"May 31, 1988",Remarks and a Question-and-Answer Session With the Students and Faculty at Moscow State University,https://www.presidency.ucsb.edu/documents/remarks-and-question-and-answer-session-with-the-students-and-faculty-moscow-state,Ronald Reagan
"Jun 06, 1988",Remarks to World Gas Conference Participants,https://www.presidency.ucsb.edu/documents/remarks-world-gas-conference-participants,Ronald Reagan
"Jun 06, 1988",Nomination of Harry E. Bergold To Be United States Ambassador to Morocco,https://www.presidency.ucsb.edu/documents/nomination-harry-e-bergold-be-united-states-ambassador-morocco,Ronald Reagan
"Jun 10, 1988",Statement by Assistant to the President for Press Relations Fitzwater on the Nicaraguan Peace Negotiations,https://www.presidency.ucsb.edu/documents/statement-assistant-the-president-for-press-relations-fitzwater-the-nicaraguan-peace,Ronald Reagan
"Jun 15, 1988",Excerpts From an Interview With International Newspaper Journalists,https://www.presidency.ucsb.edu/documents/excerpts-from-interview-with-international-newspaper-journalists,Ronald Reagan
"Jun 18, 1988",Radio Address to the Nation on Economic Growth and the Situation in Nicaragua,https://www.presidency.ucsb.edu/documents/radio-address-the-nation-economic-growth-and-the-situation-nicaragua,Ronald Reagan
"Jun 21, 1988","The President's News Conference in Toronto, Canada",https://www.presidency.ucsb.edu/documents/the-presidents-news-conference-toronto-canada,Ronald Reagan
"Jun 24, 1988",Remarks at the Presentation Ceremony for the Prisoners of War Medal,https://www.presidency.ucsb.edu/documents/remarks-the-presentation-ceremony-for-the-prisoners-war-medal,Ronald Reagan
"Jun 29, 1988","Remarks at a Campaign Fundraising Luncheon for Representative Connie Mack in Miami, Florida",https://www.presidency.ucsb.edu/documents/remarks-campaign-fundraising-luncheon-for-representative-connie-mack-miami-florida,Ronald Reagan
"Jul 12, 1988",Informal Exchange With Reporters,https://www.presidency.ucsb.edu/documents/informal-exchange-with-reporters-10,Ronald Reagan
"Jul 12, 1988",Remarks Announcing the Nomination of Richard L. Thornburgh To Be Attorney General of the United States,https://www.presidency.ucsb.edu/documents/remarks-announcing-the-nomination-richard-l-thornburgh-be-attorney-general-the-united,Ronald Reagan
"Jul 13, 1988",Remarks on Signing the Captive Nations Week Proclamation,https://www.presidency.ucsb.edu/documents/remarks-signing-the-captive-nations-week-proclamation-1,Ronald Reagan
"Jul 15, 1988",Statement by Assistant to the President for Press Relations Fitzwater on the Situation in Nicaragua,https://www.presidency.ucsb.edu/documents/statement-assistant-the-president-for-press-relations-fitzwater-the-situation-nicaragua,Ronald Reagan
"Jul 18, 1988","Proclamation 5840—Captive Nations Week, 1988",https://www.presidency.ucsb.edu/documents/proclamation-5840-captive-nations-week-1988,Ronald Reagan
"Jul 30, 1988",Radio Address to the Nation on Aid to the Nicaraguan Democratic Resistance,https://www.presidency.ucsb.edu/documents/radio-address-the-nation-aid-the-nicaraguan-democratic-resistance,Ronald Reagan
"Aug 03, 1988",Remarks to Media Executives at a White House Briefing on Nicaragua,https://www.presidency.ucsb.edu/documents/remarks-media-executives-white-house-briefing-nicaragua,Ronald Reagan
"Aug 06, 1988","Radio Address to the Nation on the Veto of the National Defense Authorization Act, Fiscal Year 1989",https://www.presidency.ucsb.edu/documents/radio-address-the-nation-the-veto-the-national-defense-authorization-act-fiscal-year-1989,Ronald Reagan
"Aug 13, 1988",Radio Address to the Nation on the Administration's Goals and Achievements,https://www.presidency.ucsb.edu/documents/radio-address-the-nation-the-administrations-goals-and-achievements,Ronald Reagan
"Aug 27, 1988",Radio Address to the Nation on Foreign Policy Achievements,https://www.presidency.ucsb.edu/documents/radio-address-the-nation-foreign-policy-achievements,Ronald Reagan
"Aug 27, 1988","Remarks at a Fundraiser for Representative Robert J. Lagomarsino in Santa Barbara, California",https://www.presidency.ucsb.edu/documents/remarks-fundraiser-for-representative-robert-j-lagomarsino-santa-barbara-california,Ronald Reagan
"Sep 06, 1988","Remarks at the National Convention of the American Legion in Louisville, Kentucky",https://www.presidency.ucsb.edu/documents/remarks-the-national-convention-the-american-legion-louisville-kentucky,Ronald Reagan
"Sep 14, 1988","Remarks at a Republican Party Rally in Cape Girardeau, Missouri",https://www.presidency.ucsb.edu/documents/remarks-republican-party-rally-cape-girardeau-missouri,Ronald Reagan
"Sep 15, 1988",Remarks at a White House Briefing for Hispanic-American News Media,https://www.presidency.ucsb.edu/documents/remarks-white-house-briefing-for-hispanic-american-news-media,Ronald Reagan
"Sep 22, 1988","Remarks at a Republican Party Fundraising Dinner in Houston, Texas",https://www.presidency.ucsb.edu/documents/remarks-republican-party-fundraising-dinner-houston-texas,Ronald Reagan
"Sep 22, 1988","Remarks at a Republican Party Rally in Waco, Texas",https://www.presidency.ucsb.edu/documents/remarks-republican-party-rally-waco-texas,Ronald Reagan
